Id,Image
w_cd22b23 new_whale w_f4e84c1 w_cd22b23 w_cd22b23,3ccc5880.jpg
w_d33c2ed new_whale w_4504167 w_8fd5636 w_4e505cc,3cd36114.jpg
w_032d44d new_whale w_8e92130 w_1894a1c w_4bf5a06,3cd3c8ac.jpg
new_whale w_a837660 w_a837660 w_b0362e2 w_49c9417,3cd6fa25.jpg
w_5d86dc6 new_whale w_2f6e76c w_20848b7 w_b6410bc,3cde6358.jpg
new_whale w_307065e w_c26b92a w_482c51f w_2901dbf,3ce5449a.jpg
new_whale w_d96c946 w_d36f58c w_b678944 new_whale,3ce552f7.jpg
new_whale w_da63cba w_78f2e92 w_53f79bc w_15928c6,3ce93435.jpg
new_whale w_e0efc4f w_d36f58c w_759b647 w_3c2ec7a,3ce9d2b2.jpg
w_064ab78 w_718ce15 w_773509f new_whale new_whale,3cea1e0f.jpg
w_28fa29e w_28fa29e new_whale w_d6856ab w_b9ee5ec,3cf0cac9.jpg
w_0988bbb w_0988bbb w_244bd92 new_whale w_a18d0dc,3cf1a1dc.jpg
w_987a36f w_552ec4e w_7538922 new_whale w_36ac97f,3cf46c0d.jpg
new_whale w_458f0aa w_788b689 w_64f3545 w_64f3545,3cf4cdf4.jpg
new_whale w_0a97a25 w_fe49bc4 w_17e8554 w_118d911,3cf7f1d7.jpg
new_whale w_92585eb w_b6c0c65 w_771374c w_771374c,3cfafcdb.jpg
new_whale w_94da90b w_20c671c w_20c671c w_d4a27fb,3d054afb.jpg
w_8a2e496 w_8327e8d w_d09e61a w_d09e61a w_7faebe3,3d06d9fc.jpg
new_whale w_9ca943b w_2f6a962 w_0beef28 w_0beef28,3d0daa18.jpg
new_whale w_9ec358c w_67de30b w_1cca86d w_d7ffaf2,3d1337d7.jpg
new_whale w_6710cf8 w_05ecba5 w_1eaebf2 w_74de378,3d1780bc.jpg
new_whale w_637f363 w_637f363 w_a14ccaa w_a14ccaa,3d191ced.jpg
w_ed69e9c w_19f7a8b new_whale new_whale new_whale,3d1f151f.jpg
w_03f060f w_49b425b w_45e8ea5 w_893e77a new_whale,3d270311.jpg
w_f986587 w_a837660 w_3449e4f w_941ca6a new_whale,3d2de452.jpg
new_whale w_c11932e w_b14007c w_4c2d259 w_5126776,3d320c9c.jpg
w_37523b2 w_7586198 new_whale w_0b3b659 w_8968506,3d3a7267.jpg
new_whale w_3bc8a47 w_3bc8a47 w_ace8c54 w_71cc46c,3d49bad6.jpg
w_203e9d5 w_63d1ea6 new_whale w_cda4b05 w_530f87b,3d4db3e4.jpg
w_bd1dbed new_whale w_932c8cd w_d5ec83f w_d5ec83f,3d52675d.jpg
new_whale w_ec853f1 w_293b5e4 w_fd698a3 w_5010531,3d572d23.jpg
w_373593e new_whale w_9f1fafb w_3f91e04 w_376a413,3d59af32.jpg
w_8de6989 w_8de6989 new_whale w_2707bcd w_2fd73d9,3d5c522f.jpg
new_whale w_2b28681 w_1911cbb new_whale w_90ec71a,3d63aa7a.jpg
w_813c5be new_whale w_45461e6 w_cd88a48 w_3f90907,3d6ea9d9.jpg
new_whale w_d1033fa w_86a7464 w_e94a3b2 w_af890ad,3d7a8736.jpg
new_whale w_33032d1 w_6b2995b w_303518a w_dfafffd,3d7d2cc1.jpg
w_338b130 new_whale w_d1b13bb w_9694b9d w_ebe0ad5,3d7d664b.jpg
new_whale w_0c45f5e w_823fcbb w_cb7b682 w_572033c,3d81dec4.jpg
new_whale w_3745f59 w_79774a5 w_900fab7 w_e3b2cfa,3d829de3.jpg
new_whale w_b7d5069 w_17e8554 w_ff7630a w_569c2c7,3d8949ee.jpg
new_whale new_whale w_90f5d3b w_90f5d3b w_69f4311,3d8f0129.jpg
new_whale w_f76af37 w_4be373e w_3f907d6 w_7d19608,3d933bda.jpg
w_1addcc2 w_d19a884 w_6affb63 w_30d8376 w_9ec358c,3d93dfcb.jpg
w_c529cf1 w_28fa29e w_f208155 w_705a70b w_fc7cc24,3d955087.jpg
new_whale w_4ebeafb w_21e178f w_e62a48d w_74de378,3d9c1c1c.jpg
new_whale w_c57623d w_20848b7 w_108eb8b w_4fb3c95,3d9d20ad.jpg
new_whale w_d1bbde9 w_625a6a9 w_d0cecd5 w_d663f4f,3daebb59.jpg
new_whale w_3d4900b w_51cdd4b w_51cdd4b w_068f5bd,3db2d351.jpg
w_156c0db new_whale w_99c07e8 w_156c0db w_47f29cd,3db64900.jpg
w_8cd3036 new_whale w_89317b0 w_7427ace w_5c0e858,3db69083.jpg
new_whale w_8c1dab2 w_8c961a3 w_1aea445 w_b588283,3dbd0342.jpg
w_92c7ace w_e7a238b new_whale w_f031837 w_4ec48a9,3dc643e4.jpg
new_whale w_b0e05b1 w_2dae424 w_eb0a6ed w_74e15fc,3dce8c69.jpg
w_57c14db new_whale w_85755f7 w_4b95330 w_3b90f9b,3dd1e6bd.jpg
w_1287fbc w_e3fbc27 w_67fecca w_ace34dc w_41ed8e8,3dd659e8.jpg
w_eb0a6ed w_a8335f2 new_whale w_c622a3f w_c622a3f,3dd77d20.jpg
new_whale w_cbd271b new_whale w_dcb1f2a w_b678944,3dd83cf8.jpg
new_whale w_0ea659e w_cece268 w_c45bfc3 w_7f5f0c9,3ddc3d7e.jpg
new_whale w_d10c9ff w_ce29d2a w_8ddc642 w_f014da3,3dde422c.jpg
w_86113c4 new_whale w_19dc50f w_19dc50f w_d9fdd15,3ddf9d46.jpg
new_whale w_fe49bc4 w_0f96780 w_e4616da w_92b35ca,3de12d23.jpg
w_6e8486d new_whale w_92c7ace w_df092eb w_8d5ede1,3dec200b.jpg
new_whale w_5557280 w_8b56cb1 w_2832e90 w_02facde,3df1a3d9.jpg
w_6a16373 w_9b67e87 w_9b67e87 w_dc89c4c w_1f09cdd,3dfa0431.jpg
new_whale w_fd9264d w_7f5f0c9 w_a7f847f w_e15442c,3dfaed2e.jpg
new_whale w_7554f44 w_8044362 w_0de84f0 w_cbedcb0,3dfc72af.jpg
w_22f0a7d w_7377b2b new_whale w_5af7a9c new_whale,3dfefebc.jpg
w_a1114ee w_8141223 w_89ca343 w_4c8244d new_whale,3e02830c.jpg
new_whale w_cc759cd w_8d46cef w_c01beb7 w_e38b2c7,3e042855.jpg
new_whale w_c84551d w_c84551d w_c00534d w_d708c5a,3e06b842.jpg
new_whale w_43be268 w_8e97748 w_7419e4b w_7419e4b,3e0c44dd.jpg
w_b0e05b1 w_cf0c062 new_whale w_ad87135 w_08f1502,3e153374.jpg
new_whale w_beb62cc w_beb62cc w_7e9e89f w_b922593,3e18558a.jpg
new_whale w_0869575 w_5ad2030 w_6710cf8 w_0beef28,3e1baa71.jpg
new_whale w_dbda0d6 w_46b211d w_e5edb40 w_8c605d2,3e3109c6.jpg
new_whale w_56f9abb w_156c0db w_09dd18c w_09dd18c,3e36720e.jpg
w_95874a5 new_whale w_bb2d34d w_bc9dc37 w_2173953,3e3c956d.jpg
new_whale w_d0e5d1d w_d0e5d1d w_3b5403b w_eea20c4,3e4bfcb2.jpg
w_fe8233d new_whale w_49308df w_74adf0b w_bf77b13,3e4cf6a7.jpg
w_8fab53d w_0324b97 w_e964ae8 new_whale w_4195fc3,3e4d6ddd.jpg
w_24ad46c new_whale w_ed8a846 w_4624237 w_6a87d0d,3e4f6f85.jpg
new_whale w_127f4c6 w_3fc8361 w_17136dc w_98d4838,3e5a8353.jpg
w_95874a5 new_whale w_351a1e1 w_351a1e1 w_e62b5d8,3e5bf43e.jpg
w_1287fbc new_whale w_dcf2001 w_dcf2001 w_b29214f,3e6285a2.jpg
w_e4df90a w_fcff830 new_whale w_15f29b7 w_3da62f8,3e6b7a65.jpg
w_e3c0ae5 w_3ee8570 w_3ee8570 w_8327e8d new_whale,3e73a870.jpg
w_6572bbe new_whale new_whale w_54a5871 w_3745f59,3e812d3a.jpg
new_whale w_4e68ddc w_0e25cf2 w_e09e886 w_cdc21df,3e8420ea.jpg
new_whale w_b329c00 w_ca1850d new_whale w_36b6904,3e882e34.jpg
new_whale w_5c13154 w_ba39ad5 w_f3f84d7 w_d2b4956,3e893596.jpg
new_whale w_a4f77bd w_7c979d9 w_a2a1378 w_f2b0e93,3e89ea79.jpg
new_whale w_f86488a w_43be268 w_414f402 w_97666c8,3e8b3b02.jpg
new_whale w_78a6f56 w_cece268 w_3ee8570 w_8a997b8,3e8d88eb.jpg
new_whale w_c90feaa w_3745f59 w_66c1b54 w_f0db0ba,3e97133a.jpg
w_8968506 w_c0bb183 new_whale w_09c1e0b w_8f50a1f,3e9930ef.jpg
new_whale w_3c0bbac w_f0f0dbb w_1287fbc w_53859b2,3ea2de6f.jpg
new_whale w_03a2ed7 w_e430ce0 w_7904cff w_49c9417,3ea88176.jpg
new_whale w_4af3e4e w_983829b w_3f0f6ba w_0ea2545,3ea8a0df.jpg
new_whale w_97e7648 w_9c5ed68 w_2f07b15 w_9caed77,3eaffce2.jpg
new_whale w_b6ed5d2 w_4ebeafb w_44cccf6 w_20e863f,3eb1d33e.jpg
new_whale w_5021993 w_7523d74 w_88e5933 w_f0a2e40,3eb7d92a.jpg
new_whale w_9ec358c w_f478955 w_1eafe46 w_67de30b,3ec161d1.jpg
new_whale w_d02787f w_e4d3ec3 w_8f1aa27 w_c8728f4,3ec63dd0.jpg
new_whale w_208de0e w_64f3545 w_6af9dd7 w_b9c9129,3eda9ab5.jpg
w_b6689cc new_whale new_whale w_f022f78 w_9b401eb,3edfb3ac.jpg
w_ec95acb w_2168906 w_7759db0 new_whale w_0b18e41,3ee0f1ce.jpg
new_whale w_55647bd w_cc5fae7 w_3e0f25d w_3e0f25d,3eea5461.jpg
new_whale w_796eebc w_711aaa1 w_beab972 w_c94f464,3eec6933.jpg
new_whale w_642de28 w_04c1951 w_9378098 w_9378098,3eeca2e1.jpg
new_whale w_98baff9 w_8c1ec28 w_851a7f4 w_5b5a85d,3ef5a3ca.jpg
new_whale w_330f897 w_e594616 w_1c69443 w_8cd3036,3ef7696e.jpg
new_whale w_0853262 w_5ee752a w_613723e w_a3dfe32,3ef7e7f1.jpg
w_abe383e w_6af9dd7 w_e0f1df1 w_89973e5 w_7cc620b,3ef82b19.jpg
new_whale w_d19a884 w_0bd3671 w_5af83da w_3a78626,3ef9e313.jpg
w_5aa4856 w_0337aa5 new_whale w_d8421c1 new_whale,3efb7847.jpg
new_whale w_edcb241 w_9269ec6 w_0acce53 w_ca3bb23,3efd87de.jpg
new_whale w_41afa58 w_f81c626 w_a335e80 w_18eee6e,3f041163.jpg
new_whale w_d234e6b w_dbda0d6 w_dbda0d6 w_598b8ab,3f0b4016.jpg
new_whale w_bd1c23d w_6af9dd7 w_9927328 w_3e1ba5b,3f0f0cfc.jpg
new_whale w_3f0f6ba w_26bd720 w_ed10a36 w_d014794,3f1a9fa0.jpg
w_0a97a25 w_f02bf23 new_whale w_aa7e5f4 w_92d390e,3f1af992.jpg
new_whale w_b4732ef w_d88328d w_8596faf w_17e8554,3f1e2d7d.jpg
new_whale w_b624ed1 w_eb39613 w_c622a3f w_c11932e,3f1e5e8a.jpg
w_def505e w_7cfaa82 w_656afeb new_whale w_59eb8ae,3f1ecbc5.jpg
new_whale w_67fecca w_03b5e9a w_15d7ecf w_15d7ecf,3f27d210.jpg
new_whale w_81b402a w_83034c7 w_e41fd4f w_c3684ba,3f2a2fa2.jpg
new_whale w_2b0028d w_2b0028d w_63d1ea6 w_a4b6a86,3f2c200a.jpg
new_whale w_b4732ef w_f790728 w_ee17a08 w_02d5fad,3f2c7924.jpg
new_whale w_ab4cae2 w_c00534d w_57c8da9 w_693c9ee,3f3057a8.jpg
w_68820e8 w_0308405 w_80c692d w_76387b4 w_cb9220b,3f35d8b1.jpg
w_2663598 new_whale w_cdda58e w_7637760 w_1e45a47,3f4a4bc4.jpg
new_whale w_681dba6 w_9146eae w_83a922d w_e53334f,3f521aec.jpg
new_whale w_ba4cd1a w_3af4e73 w_ca94288 w_ca94288,3f5e0ae7.jpg
w_1a70685 new_whale w_8d83172 w_8d83172 w_17d5eb9,3f5f9a6e.jpg
new_whale w_d0b237f w_1ac4c38 w_59eb8ae w_ab6db0f,3f60f5d1.jpg
w_53859b2 new_whale w_5bc7e7f w_6ba46a1 w_53859b2,3f65a8ff.jpg
new_whale w_a964291 w_d0157fd w_d0157fd w_0fa8587,3f6c5b77.jpg
new_whale w_dd2bd69 w_9dfbd27 w_83cd92b w_c01e25d,3f6e6380.jpg
new_whale w_272259b w_43be268 w_7b035cc w_4b04829,3f6f88e4.jpg
new_whale w_61d516e w_c0f377b w_1a5beb9 w_861cc1c,3f735781.jpg
w_5f2b407 new_whale w_422420c w_987a36f w_01b2250,3f74813b.jpg
w_741861e new_whale new_whale w_3461d6d w_313b78a,3f761452.jpg
w_83714b7 w_c9dc73e new_whale w_958b908 w_af890ad,3f794b35.jpg
w_1dff010 new_whale w_6c8601e w_d7ffaf2 w_1743d93,3f7a238c.jpg
new_whale w_9122179 w_cb7d1b5 w_da63cba w_01b2250,3f7a7e22.jpg
new_whale w_bc18612 w_9438980 w_2863d51 w_4ec48a9,3f80e7ed.jpg
new_whale w_9b6b87d w_15f29b7 w_6d17527 w_e00a916,3f8311a0.jpg
new_whale w_ff5538f w_1a229eb w_125095f w_881f3c4,3f840442.jpg
w_f5b8faf w_43be268 new_whale w_aae82f8 w_1905c66,3f841907.jpg
new_whale w_3a9ee71 w_376a413 w_f93d780 w_db5cc79,3f849643.jpg
new_whale w_dbda0d6 w_dbda0d6 w_6926f08 w_ee17a08,3f849bc0.jpg
w_e8ae8c1 w_1f2a32a w_a646643 w_a646643 w_11b993a,3f880c85.jpg
new_whale w_217e78a w_dff77b6 w_dff77b6 w_da63cba,3f8a76de.jpg
new_whale w_1eafe46 w_09dd18c w_ab1c859 w_f12415b,3f8c46b3.jpg
new_whale w_64f3545 w_64f3545 w_8e4fa60 w_33909b8,3f919cbc.jpg
new_whale w_b942708 w_5a0d250 w_daf162a w_daf162a,3f953fd3.jpg
new_whale w_1add6ae w_45461e6 w_aa7e5f4 w_a494171,3f97dcdf.jpg
new_whale w_1e45a47 w_29c9595 w_661dacb w_14c8f15,3f993cb6.jpg
w_55647bd w_fd587bc w_fd587bc w_c666071 new_whale,3fa05329.jpg
new_whale w_b729b1f w_d89b29e w_23e4e61 w_1a5beb9,3fa15942.jpg
new_whale w_e3c1ec4 w_eb47189 w_da7d77c new_whale,3fa19e5a.jpg
new_whale w_cce912e w_6e742e5 w_434ad6a w_8d46cef,3fa2dd21.jpg
new_whale w_5f8c5d3 w_3d12652 w_fec6413 w_9ab6e50,3fa94ac0.jpg
w_2111212 w_7e4d894 new_whale w_c280a12 w_f0af1f8,3fac58e1.jpg
new_whale w_a21cc97 w_cc1f8bc w_2870b33 w_120927e,3facb60e.jpg
w_813c5be new_whale w_56bbc91 w_9cb529f w_6e47e0e,3facd290.jpg
new_whale w_4953ce7 w_5deefd9 w_a1350a7 w_1d37fb6,3fb01bea.jpg
new_whale w_e59a1f0 w_9ceb05d new_whale w_0beef28,3fb2b62d.jpg
new_whale w_fb2b2c2 w_9b6b87d w_15d7ecf w_0f8b515,3fb49113.jpg
w_62ec01b w_1d53d9c w_79581d3 w_42addf7 w_61b5906,3fb88d12.jpg
w_4a78bf2 new_whale w_208de0e w_38efc2d w_fe36b07,3fbbb35f.jpg
new_whale w_87e00c8 w_4a4546c w_b648329 w_7cd711c,3fc2e9e5.jpg
w_d84ed05 w_cef1b93 w_aaf443d new_whale w_d88328d,3fc39141.jpg
w_1287fbc new_whale w_c0d494d w_0134192 w_79d4855,3fc7fd6c.jpg
new_whale w_3608443 w_b67bfeb w_f70f725 w_dc81791,3fcbdd7e.jpg
w_660629d w_9c4bb3c w_fd1cb9d w_da63cba w_cb9220b,3fcca0ac.jpg
w_2fd21ec w_21e178f w_b34793e new_whale w_1a2b4f2,3fd554b2.jpg
new_whale w_97493dd w_fdc8bf6 w_df82632 w_6092d5c,3fd586e3.jpg
w_694c109 w_83e0203 new_whale w_22f0a7d w_9378098,3fd60ccc.jpg
w_f70bf4d w_92be3ca new_whale w_dcb1f2a w_ae07541,3fda3d0e.jpg
new_whale w_542f8ca w_70daaba w_2fdf63b w_72c15c4,3fddf958.jpg
w_57c14db w_e8ae8c1 w_0f20cbc new_whale w_9548fcf,3fe023de.jpg
w_67de30b w_540fd73 w_7d9642c w_88f57d0 new_whale,3fe11fab.jpg
w_f8c9150 w_5d84c65 new_whale w_b0e05b1 w_9caed77,3fe52f4a.jpg
new_whale w_9694b9d w_f8e6546 w_7586198 w_a26a029,3fe5ad0b.jpg
new_whale w_9927328 w_b6c4efa w_a38d1a3 w_cd70e8b,3fe65c2e.jpg
w_d19a884 new_whale w_bf38f05 w_69e7dab w_a3c6ed0,3ff016bd.jpg
w_02c9470 new_whale w_27cf4e2 w_f3db3f1 new_whale,3ff0a42f.jpg
w_9ba1eee w_0ac6a0a w_0ac6a0a new_whale w_7538922,3ff30bc1.jpg
new_whale w_681dba6 w_1638016 w_8f2fb79 w_8f2fb79,3ff4bda5.jpg
w_a335e80 new_whale w_2fd21ec w_2a18a44 w_86113c4,3ff7de04.jpg
w_a06bdc4 new_whale w_4855bd3 w_987a36f w_d1bbde9,4003cd6e.jpg
new_whale w_fe054f3 w_1a229eb w_1a229eb w_48bcad8,4006a5c7.jpg
new_whale w_d6815ff w_d6815ff w_71764b4 w_a59905f,400ccc36.jpg
w_dfbfe10 w_5f5ef4e new_whale w_e156c87 new_whale,401a1fb6.jpg
w_98baff9 w_efd3f81 w_c0323f5 w_9ab6e50 w_1f6e1db,401bd05f.jpg
new_whale w_5d0666e w_08d1ccd w_e4f1fcc w_8114b1b,401f97ac.jpg
w_e1f55ad new_whale w_78f64d1 w_5cef366 w_bf77b13,4023c311.jpg
new_whale w_d5ec83f w_057c418 w_057c418 w_286ec5f,4025e9b0.jpg
new_whale w_d8f848c w_d9aab0a w_4b33077 w_ad370e1,40266ccc.jpg
new_whale w_a4b6a86 w_a7f847f w_cddb3f4 w_349fcbc,4032812c.jpg
new_whale w_e548eb7 w_667833e w_797e546 w_ac8329d,40391340.jpg
w_61ffd2c w_e7a238b w_e7a238b w_656490c w_38e4aae,404d9a9a.jpg
new_whale w_dc89c4c w_f18df18 w_dfbfe10 w_dc89c4c,404fb5b9.jpg
w_42dd100 w_41f0a7e w_7386509 w_3fc3d07 new_whale,4050c24a.jpg
new_whale w_af04ba6 w_ccbc782 w_5c32d2a w_314d77b,4051a842.jpg
new_whale w_b46bd60 w_a7202e1 w_48a5b86 w_48a5b86,405c2115.jpg
new_whale w_1ae1386 w_4c9d3df w_38e4aae w_c61ed17,405d8f57.jpg
w_a25d46c w_a254eb0 w_6d274b2 w_05567a9 new_whale,406065e9.jpg
new_whale w_6132293 w_5c59d12 w_cb8edf5 w_eac205a,40665236.jpg
new_whale w_871b1b9 w_851a7f4 w_cc54cee w_1272a31,406d5259.jpg
w_64d8a6d w_21a1bdb w_d775542 w_3297a52 w_b8236d6,406e3c5c.jpg
new_whale w_56ccad1 w_8fb79a2 w_f60c7e8 w_f60c7e8,40709767.jpg
new_whale w_bf4880a w_3cdf114 w_98baff9 w_40be51f,407510dd.jpg
new_whale w_3621c49 w_0827d51 w_c027e4e w_7f40920,40798051.jpg
new_whale w_be3c0f5 w_4684a3f w_0f96780 w_b7d5069,407da55c.jpg
w_6c803bf w_1a70685 w_32a920b w_1f09cdd new_whale,408abe70.jpg
w_1da7080 w_9291cdf w_5b99089 w_5b99089 new_whale,408ccf48.jpg
w_f8c3a63 new_whale w_f19faeb w_f19faeb w_f19faeb,408ecac5.jpg
w_cb7b682 w_af04ba6 new_whale w_7637760 w_1c22d7e,409647a9.jpg
new_whale w_a21cc97 w_e44d512 new_whale w_710a3a3,4099d730.jpg
new_whale w_95874a5 w_a59905f w_2173953 w_2173953,40a16009.jpg
new_whale w_2dce318 w_7b1686d w_4bf5cf7 w_e73c666,40a2fb45.jpg
new_whale w_7b0fb1d w_572033c w_73cbacd w_f256b56,40a34b23.jpg
new_whale w_2cdf820 w_a5a13d0 w_4b83ce2 w_95874a5,40a81485.jpg
new_whale w_6c803bf w_c9e1cdc w_8376b7e w_0d39a68,40a92793.jpg
new_whale w_09c1e0b w_ab4cae2 w_7285eb3 w_108eb8b,40ab388f.jpg
w_1596a47 w_bdafa8d w_6af9dd7 w_1596a47 new_whale,40aec8f9.jpg
w_3bc8a47 new_whale w_f2eb971 w_67599af w_7538a4c,40b1d13f.jpg
w_d708c5a w_d708c5a w_b081817 w_48dd419 w_d62128e,40b5358b.jpg
w_2ac83b0 w_5102893 new_whale w_c3f9618 w_41c0098,40b5e448.jpg
new_whale w_864be50 w_078b0e7 w_44f0fa2 w_2cb8996,40b94983.jpg
w_27633c3 w_599d0df w_216f61f w_4a78bf2 w_4a78bf2,40bbd78a.jpg
new_whale w_0b7e949 w_b1c44fe w_2356a6d w_00cb685,40bd0215.jpg
new_whale w_4a1e58b w_3a7d86d w_3a7d86d w_8a4b8ef,40bdf228.jpg
new_whale w_79b42cd w_eb0a6ed w_a837660 w_b693f13,40c1e233.jpg
new_whale w_a06bdc4 new_whale w_3f550fa w_a3cd405,40c342a6.jpg
new_whale w_0d39a68 w_d141590 w_89e159a w_89e159a,40c3a13f.jpg
new_whale new_whale w_b70a0c4 w_0e0e856 w_6556c5c,40c89f54.jpg
new_whale w_b61840c w_7c6ad05 w_9cb529f w_e826a6f,40cb7565.jpg
new_whale w_a3cd405 w_d1bbde9 w_286ec5f w_d1bbde9,40ced212.jpg
new_whale w_df15cc8 w_414f402 w_3b0894d w_3b0894d,40d7001d.jpg
new_whale w_c90c37a w_0a565c5 w_56f2b1e w_23e5a4c,40db0642.jpg
new_whale w_6b4af70 w_a524549 w_9aeb18f w_b0e05b1,40dee206.jpg
w_78999a6 new_whale w_06972d2 w_4fdaa2a w_e61dd6d,40e2b2fa.jpg
new_whale w_1ec0481 w_a464d28 w_9146eae w_cece268,40e30541.jpg
new_whale w_1eafe46 w_f64cf8a w_f663b5e w_c57623d,40e828bf.jpg
new_whale new_whale w_20f86e1 w_1f10750 w_9f638d8,40e91a1d.jpg
new_whale w_39a31a8 w_961ba76 w_76c1200 w_7f199c6,40f443c1.jpg
w_1287fbc new_whale w_b2cded6 w_79cde72 w_993d66c,40fd1339.jpg
new_whale w_23e4e61 w_23e4e61 w_186bcab w_186bcab,4104e6d9.jpg
new_whale w_a0149f9 w_a8335f2 w_0acce53 w_5021993,41053bb2.jpg
new_whale w_e62b5d8 w_d382236 w_900f9eb w_900f9eb,410679db.jpg
new_whale w_7de72c5 w_3f2a05c w_fd218ba w_18df014,41074c95.jpg
new_whale w_f4b95e7 w_b8dff40 w_a335e80 w_ec354a5,41192293.jpg
new_whale w_7307089 w_9967edd w_c241e72 w_a837660,411c897b.jpg
new_whale w_b3e6069 w_73d5489 w_ba56291 w_c551c9d,4120bc17.jpg
w_65efe4d new_whale w_c7efb86 w_f8e6546 w_42af75d,413167bd.jpg
new_whale w_39d2684 w_2af3059 w_fd218ba w_cf0c062,4133c649.jpg
new_whale w_93d42a1 w_d36f58c w_7c6ad05 w_4b83ce2,4139fa44.jpg
w_f5b8faf w_414f402 new_whale w_c34afd7 w_123a47f,413ab823.jpg
w_b4369cc w_1cca86d w_1274a11 new_whale w_656afeb,413d40a1.jpg
new_whale w_bb2d34d w_011d4b5 w_8c1ec28 w_9ceb05d,4146aa4d.jpg
new_whale w_6ef68ed w_e38b2c7 w_f660d7d w_4e7fc3e,4149ab56.jpg
new_whale w_972f231 w_7e8305f w_31d3999 w_17e592c,4149ad11.jpg
w_85b0d73 w_6737f89 new_whale w_c34afd7 w_bdafa8d,41503703.jpg
new_whale w_dd90e0a w_6202983 w_c133ea8 w_35453e0,4154d293.jpg
new_whale w_3572b44 w_7e8305f w_1c6d5f0 w_de20ab0,4156daf1.jpg
w_6ba46a1 w_0bc1db0 w_0bc1db0 w_0e7cb1c w_beab972,415921ce.jpg
new_whale w_fe49bc4 w_fe49bc4 w_0ee4d6d w_813c5be,415bfcc3.jpg
w_43b50e5 w_8d83172 w_e3c1ec4 new_whale w_d0b237f,415c6aa3.jpg
new_whale w_0f2f6e6 w_09dd18c w_09dd18c w_f188f95,415e0e8f.jpg
w_d88328d new_whale w_b9c9129 w_b9c9129 w_64f3545,41609ec9.jpg
new_whale w_00fbb4e w_fab0b50 w_a74742c w_4bd8388,416a4c3a.jpg
w_5a81425 w_b9417ee w_b9417ee w_20f86e1 new_whale,417752ec.jpg
w_2e977e2 new_whale w_ba8c7bc w_ae07541 w_32037e2,41778c60.jpg
w_90f74ae w_0fa8587 w_4e7fc3e w_681dba6 new_whale,4178508a.jpg
w_c87b956 new_whale w_ad3dd0b w_f43935f w_a2a1378,4179e672.jpg
new_whale w_e147c40 w_fcfcf68 w_29eb3b2 w_cf7eebd,418024db.jpg
new_whale w_d782e1b w_c27d036 w_ee24bac w_f18df18,41874ee7.jpg
new_whale w_9c5ed68 w_17b33ae w_5810973 w_5810973,418a06e6.jpg
w_046634b w_731e3aa w_4b7b80b new_whale w_5cc2285,418e4be5.jpg
w_449a34e w_6af9dd7 w_2d99a0c w_286ec5f w_d88328d,4194da1f.jpg
new_whale w_1addcc2 w_30d8376 w_36d665c w_5d50ea2,419e59e1.jpg
new_whale w_73c9ba2 w_2b0fc31 w_964c1b3 w_0b0b7cc,41a1668e.jpg
w_46ec664 new_whale w_8d9c6fc w_e249d94 w_eec1133,41a1baf4.jpg
new_whale w_65943d6 w_0a97a25 w_4659acf w_4659acf,41a871cf.jpg
w_6e8486d w_6e8486d w_32a920b new_whale w_dfec7a3,41aba708.jpg
new_whale w_c01beb7 w_e38b2c7 w_8d46cef w_33973bf,41aef483.jpg
new_whale w_372909c w_17411dd w_0f92544 w_af6c7e2,41b10e26.jpg
w_ba8c7bc new_whale w_92be3ca w_15b9665 w_f70bf4d,41b28ad7.jpg
new_whale w_8ecd3a7 w_3a78626 w_cc8241b w_11b993a,41b3e3f2.jpg
new_whale w_f8c9150 w_e15442c w_24a2923 w_cddb3f4,41b741de.jpg
new_whale w_cd22b23 w_cd22b23 w_28ce17c w_d8421c1,41ba8aa5.jpg
w_78f2e92 w_e0efc4f w_07274b2 new_whale new_whale,41bcea05.jpg
new_whale w_ade77e6 w_76d5723 w_69e88da w_76d5723,41c23152.jpg
new_whale w_c95a0ea w_7c943ab w_2168ae2 w_2c0af5e,41c2b01b.jpg
w_0e7cb1c w_1ddb63f w_ba53619 new_whale w_305ed07,41c404a4.jpg
new_whale w_c10ffe9 w_def505e w_fb72090 w_fb72090,41c40a8e.jpg
new_whale w_df21074 w_f3b63ba w_fab0b50 w_80c692d,41ce07a0.jpg
w_f099dc8 new_whale w_218b25e w_dcb1f2a w_dcb1f2a,41d054a9.jpg
new_whale w_ace5d0c w_e700deb w_e700deb w_8397970,41d3f4c3.jpg
w_fd1cb9d w_74de378 w_0ebd514 w_0e737d0 w_1c3cecd,41e30a15.jpg
new_whale w_e6d3a57 w_d22af00 w_0dbfc31 w_77e1d3f,41e643be.jpg
w_c0560ac new_whale w_50d2084 w_8a5ff14 w_f5b8faf,41e67d5d.jpg
w_42dd100 w_41f0a7e w_7386509 w_3fc3d07 new_whale,41e6c5fa.jpg
new_whale w_494dd45 w_212ad82 w_41afa58 w_1dc66b7,41e6e9a5.jpg
w_38b1edd w_dcf2001 w_7459706 w_7600863 new_whale,41f099fe.jpg
w_9321960 w_b0b275e new_whale w_4404247 w_e6d0696,41f6044b.jpg
w_4b87cba w_ee17a08 new_whale w_e158680 new_whale,41f64f78.jpg
new_whale w_4fb3c95 w_dd90e0a w_0e737d0 w_e6ec8ee,41f949b6.jpg
w_18eee6e w_5d6786e w_01c2cb0 w_01c2cb0 new_whale,41facfd0.jpg
new_whale w_ca94288 w_ca94288 w_e1431ba w_987a36f,41fec496.jpg
w_7e8305f new_whale w_49308df w_ada188f w_518129a,42031b49.jpg
w_64d8a6d w_9771603 w_9771603 w_c6be61e new_whale,420a4dae.jpg
new_whale w_58bca3c w_97da401 w_1a229eb w_1746c88,42166c4b.jpg
w_febafc1 w_febafc1 w_c84409b w_9b6b87d new_whale,42234237.jpg
new_whale w_964ce09 w_db474c7 w_fcff830 w_a56d9ff,4229d5fd.jpg
w_9ba1eee w_0ac6a0a w_0ac6a0a new_whale w_7538922,422e0509.jpg
new_whale w_147b62b w_414f402 w_4b04829 w_1014df7,422f6b22.jpg
new_whale w_7c979d9 w_4b7b80b w_fe8233d w_034a3fd,423346d6.jpg
new_whale w_7914111 w_9967edd w_9948a99 w_c241e72,42366010.jpg
w_dc89c4c new_whale w_97f5054 w_1a5e7a2 w_1a5e7a2,423694c5.jpg
new_whale w_4659acf w_a5a13d0 w_b05f565 w_18eee6e,423741c3.jpg
w_4659acf w_cc8d317 new_whale w_79774a5 w_8201aa8,423a7c6f.jpg
new_whale w_fd1cb9d w_b41e229 w_9ca943b w_a59905f,4244e0d4.jpg
w_def715a w_96b697f new_whale w_35eb420 w_dab33f6,42464eb7.jpg
new_whale w_3a7d86d w_3a7d86d w_c27d036 w_7b5a630,424fdf7c.jpg
new_whale w_0988bbb w_0988bbb w_f18df18 w_5a6d315,42565d89.jpg
new_whale w_b71eab2 w_90201e3 w_09be3ad w_8397970,4257149e.jpg
new_whale w_1ec267f w_0308405 w_cb9220b w_6a2c07f,425c27ab.jpg
new_whale w_46540b1 w_d3857a6 w_7ed0d17 w_3f90907,426261b0.jpg
new_whale w_e58fbe3 w_9cb529f w_5a8e397 w_8b56cb1,42645713.jpg
w_a59905f w_1310342 w_c30959a new_whale w_43be268,426665af.jpg
new_whale w_516bedb w_338d945 w_8b1cd49 w_9741f42,426abd56.jpg
w_b6ed5d2 new_whale w_89e159a w_2957331 w_587d2e3,4276072e.jpg
w_372ae75 w_372ae75 w_56bbc91 w_8d46cef w_56bbc91,427cc264.jpg
new_whale w_f70f725 w_3ac13d2 w_8e93d0e w_434ad6a,427d6664.jpg
new_whale w_0fa8587 w_c4e71b6 w_c0648b9 w_4759be5,4280f72a.jpg
new_whale w_5e04db0 w_73b705e w_5f50b5e w_c0d494d,42818f77.jpg
w_b96d4e0 w_22bcbd6 new_whale w_9b098ea new_whale,429ef3f1.jpg
w_530f87b w_d37b55b w_c6823b1 w_a494171 w_40323ac,42ae2342.jpg
w_17d5eb9 w_85f9040 w_6c803bf new_whale w_5af463d,42ae50d8.jpg
w_d1d8f98 new_whale w_fd07344 w_7c7a78c w_89e159a,42b08fcd.jpg
new_whale w_7ab1759 w_0beef28 w_a59905f w_6710cf8,42b2b936.jpg
w_123a47f w_f5b8faf w_ad370e1 w_c0560ac new_whale,42b3e3da.jpg
new_whale w_cfe35d4 w_cfe35d4 w_dace6e9 w_2356a6d,42b8a87b.jpg
new_whale w_b066aa6 w_7554f44 w_f1a4389 w_8f593d4,42bd4c60.jpg
w_0988bbb w_0988bbb w_e3c119c w_c87651d w_ab4cae2,42bda7a1.jpg
w_9d65e55 w_ee24bac w_7386509 w_2669d75 new_whale,42bf6154.jpg
new_whale w_4fb3c95 w_6503ccd w_d19a884 w_7852bd1,42c36d41.jpg
w_83b5e33 w_7875b79 w_1127c35 new_whale w_3d3c0f9,42c50637.jpg
new_whale w_15928c6 w_aa67f17 w_b39c722 w_7437489,42cd8d67.jpg
new_whale w_b604c18 w_85cdd9b w_b48535f w_97e9f7f,42d410b1.jpg
new_whale w_44cccf6 w_dcb1f2a w_9771603 w_9771603,42d464be.jpg
new_whale w_1cd9331 w_02e5407 w_1306632 new_whale,42d57727.jpg
w_1a5e7a2 w_c9e1cdc w_c9e1cdc w_3d0bc7a w_6c803bf,42df214c.jpg
new_whale w_d97d54c w_8fb79a2 w_3cdf114 w_e84ca75,42e5fc35.jpg
w_8327e8d w_8867074 w_d19a884 new_whale w_059df09,42e7d8e6.jpg
new_whale w_c01e25d w_186bcab w_73d5489 w_392bee3,42e8dc67.jpg
w_d6a6360 w_d6a6360 w_1306632 w_1cd9331 w_11c504f,42eff3c0.jpg
new_whale w_8f776ed w_9e7021b w_59866ca w_4fd48e7,42f18f93.jpg
w_80618a3 new_whale w_e93d181 w_80245ee w_813c5be,42f6ab5b.jpg
new_whale w_95874a5 w_d434526 w_f70bf4d w_1310342,42f8fda6.jpg
new_whale w_ba17206 w_5f82501 w_5f82501 w_62799b5,42fc05a6.jpg
new_whale w_175536a w_010a1fa w_72dfe51 w_3b99025,42fca740.jpg
new_whale w_338b130 w_d1b13bb w_c3f9618 w_9694b9d,42fcd9ef.jpg
new_whale w_4d528e4 w_fd1cb9d w_f86488a w_817f022,42fd0049.jpg
w_c0bb183 w_853c1f7 new_whale w_e2e56e9 w_3326396,430753c0.jpg
new_whale w_9ec358c w_6f2c662 w_e8bce8a w_987a36f,430d2b37.jpg
w_fa32440 new_whale w_8044362 w_1489751 w_7586198,4313c71b.jpg
w_3572b44 new_whale w_3e0f25d w_3e0f25d w_29670e2,431c14a5.jpg
new_whale w_a4b6a86 w_ddbf533 w_7028d77 w_44a6b62,431e285c.jpg
new_whale w_c622a3f w_7311fe4 w_a1237e3 w_55ce558,431f7aa2.jpg
new_whale new_whale w_e4616da w_e4616da w_ff94ad6,432e7861.jpg
w_c1b685f new_whale w_5f50b5e w_5f50b5e w_bb388ca,43317cb0.jpg
w_bb2d34d new_whale new_whale w_63db6f9 w_e594616,43348189.jpg
w_f51b4bc w_ba0d756 w_4fa1bd5 new_whale w_5af463d,43376987.jpg
new_whale w_1eaebf2 w_c39fceb w_7b035cc w_ee22376,4339198d.jpg
w_64f3545 w_b9beaf5 w_6af9dd7 w_89973e5 w_a8458c8,433e87b8.jpg
new_whale w_efbb71a w_d398969 w_7523d74 w_e09e886,43416414.jpg
w_a21cc97 w_576db5d new_whale w_fca13e2 w_25fdcfb,43427188.jpg
new_whale w_12cdfbd w_f660d7d w_13249f1 w_a789d49,434745e6.jpg
new_whale w_0e4f53c w_24ad46c w_35ffe80 w_af890ad,43476a3e.jpg
new_whale w_bd61ca9 w_8c605d2 w_79071e8 w_d76d3bb,434d2438.jpg
w_7d7d108 new_whale w_f746a73 w_f746a73 w_e6ddfe1,434dcad3.jpg
new_whale w_1127c35 w_ef99fe9 w_24ad46c w_e41f2fa,434dfd1a.jpg
new_whale w_24fda6e w_24fda6e w_84a13d3 w_f70f725,43547421.jpg
w_17ee910 new_whale w_da2efe0 w_35f0fd9 w_0f54cdf,43547cf4.jpg
w_d25a717 w_3664a22 w_7419e4b w_3e1ba5b w_e0f1df1,436083bc.jpg
w_d9aab0a w_d9aab0a w_3c0bbac w_883557a w_b7a832a,4361e154.jpg
w_e3c1ec4 w_4e52a49 new_whale new_whale w_e54feba,43654cc9.jpg
new_whale w_ccca0db w_db3621e w_8d83172 w_da7d77c,436822ed.jpg
w_a837660 new_whale w_7763134 w_959b917 w_0f9166e,436f533f.jpg
new_whale w_b0a5c8d w_dba0cd8 w_24ac53d w_2658649,43735e8d.jpg
new_whale w_b721e96 w_b721e96 w_ca0ec7c w_8716ad9,43740a3a.jpg
new_whale w_4b47559 w_5297ab3 w_78a6f56 w_69e7dab,43771df5.jpg
w_2554558 w_3ee8570 new_whale w_c11932e w_6e120c4,4378186a.jpg
w_f37508c w_3ce788a w_a4678de w_b952580 new_whale,43782183.jpg
new_whale w_b6886e5 w_b6886e5 w_6f2c662 w_d5ec83f,437af947.jpg
new_whale w_831f124 w_6a78025 w_3cbccb7 w_a964291,4381995b.jpg
w_3197568 w_b38374a w_aae82f8 new_whale w_41ed8e8,4384479b.jpg
new_whale w_349fcbc w_eb9ab29 w_c068ed3 w_c2ea3f0,43880d5d.jpg
new_whale w_7554f44 w_7554f44 w_471cca4 w_ab2d17a,438c7fbf.jpg
new_whale w_27736a0 w_dee1df3 w_dee1df3 w_01c2cb0,438eb644.jpg
new_whale w_13c6b6b w_aed023d w_a2f5cc0 w_19aeb9c,4398a83f.jpg
new_whale w_d0b237f w_7a2dfd7 w_6c803bf w_6c803bf,439c8ba3.jpg
w_68b47a1 new_whale w_0bbb3de w_339c8ae w_8158b1f,439f5058.jpg
w_dc7c5a0 w_8431164 new_whale w_89d9c03 w_89d9c03,439f74c2.jpg
new_whale w_b688397 w_8a3449f w_eb39613 w_b1d6681,43a7d0ee.jpg
new_whale w_41d32aa w_8b15b96 w_5d96ba4 w_5d96ba4,43a96e52.jpg
