Id,Image
w_1eafe46 w_9875c12 w_a59905f new_whale w_4d98ef7,bd6450b6.jpg
w_4bd8388 w_b5d8846 w_2bb8c37 new_whale w_10bea88,bd67c601.jpg
w_1924883 w_4659acf w_8867074 w_dad23fa w_fd1cb9d,bd6b7f9e.jpg
w_cf25b86 new_whale w_6e5b022 w_414c24a w_eb5b6aa,bd6b9eb3.jpg
new_whale w_073f071 w_5f54bf3 w_593485f w_b55242e,bd6c680c.jpg
w_2901dbf w_d5ec83f w_44cccf6 w_cb32cb8 w_49bbc79,bd6d9c1b.jpg
new_whale w_d234e6b w_dbda0d6 w_dbda0d6 w_dbda0d6,bd6e336f.jpg
new_whale w_cc1f8bc w_4c9d3df w_92d55a6 w_bb2d34d,bd70f118.jpg
new_whale w_7c2d27c w_af890ad w_8a2793e w_86a7464,bd745e40.jpg
w_f7bf28d w_76048fe w_c39fceb w_8936f42 w_afe57c6,bd772a54.jpg
w_dbda0d6 w_dbda0d6 w_6719a5b new_whale w_3050553,bd7b04c1.jpg
new_whale w_e0f1df1 w_0fecdf7 w_2d99a0c w_7e49f1e,bd7db643.jpg
w_1eafe46 w_39043c9 w_efd3f81 w_3674103 w_108eb8b,bd86014d.jpg
new_whale w_900fab7 w_0a97a25 w_67de30b w_3745f59,bd8854e4.jpg
w_05567a9 w_a526492 w_dab1fb4 w_a25d46c w_efd3f81,bd9021a3.jpg
new_whale w_6af9dd7 w_8d46cef w_bbf20b4 w_f5b8faf,bd902306.jpg
w_d6df554 w_d6df554 w_242a05d w_242a05d new_whale,bd9ceea9.jpg
new_whale w_e38b2c7 w_cc759cd w_8d46cef w_c01beb7,bda57ae3.jpg
new_whale w_2832e90 w_f18af3b w_a59905f w_62f299e,bdac6918.jpg
w_af98182 new_whale w_24ad46c w_dbf4e7f w_7c2d27c,bdaedb10.jpg
new_whale w_e73d83c w_21745f8 w_817f022 w_817f022,bdafe713.jpg
w_e17c752 w_89154d2 new_whale new_whale w_1c432e7,bdbf742d.jpg
new_whale w_7e49f1e w_ca40961 w_ec02248 w_974c0ea,bdc5bccc.jpg
w_b678944 new_whale w_77e3e0f w_b1f6e70 w_c3684ba,bdc8f8c0.jpg
w_0e9f6d9 w_20f86e1 new_whale w_b678944 w_79d4855,bdca3199.jpg
w_81b402a new_whale w_1eafe46 w_dd52cfc w_e41fd4f,bdcdb761.jpg
new_whale w_9c5ed68 w_17b33ae w_5810973 w_5810973,bdd9865b.jpg
new_whale w_1d4f970 w_1d4f970 w_656afeb w_06972d2,bdde0374.jpg
w_40323ac w_5d335c3 w_5f47726 w_a2b3d53 new_whale,bde2e050.jpg
w_7cd711c new_whale w_212b985 w_3026ce2 w_34c4927,bde31f6b.jpg
new_whale w_b1d6681 w_fcff830 w_15eae33 new_whale,bde850e5.jpg
new_whale w_b3e6069 w_0acce53 w_40a8760 w_0ea659e,bdea0bb4.jpg
new_whale w_c99f5ef w_7c7a78c w_80245ee w_dbaa2b1,bdef8fb3.jpg
new_whale w_a24f581 w_e3c119c w_1eafe46 w_1eafe46,bdf131b2.jpg
new_whale w_a51b387 w_3f365f3 w_0771d4b w_28ce17c,bdf86b00.jpg
w_3f12226 new_whale w_8968506 w_6be343c w_c102ec3,bdfab6ad.jpg
new_whale w_7307089 w_fb99d39 w_37223f9 w_ea6651e,bdfcedec.jpg
w_964c1b3 w_964c1b3 new_whale w_e30e97f w_238a4ad,be02974a.jpg
new_whale w_8b15b96 w_f852d15 w_9412d1b w_02c9470,be02cda4.jpg
new_whale w_d708c5a w_d708c5a w_050d056 w_7e93962,be0934f0.jpg
new_whale w_33b9360 w_33b9360 w_2e977e2 w_3e73d8a,be0c1ba6.jpg
new_whale w_86ff8a6 w_4fb3c95 w_0fea5a3 w_701972b,be184c3b.jpg
new_whale w_5317c46 w_9434f0c w_dfafffd w_aa64cc1,be1979fa.jpg
new_whale w_1eafe46 w_24212f5 w_f932abc w_09c1e0b,be1aee67.jpg
new_whale w_5f82501 w_97e7648 w_5919cf7 w_5f82501,be1bc4f0.jpg
new_whale w_ef2f0f0 w_67de30b w_62f299e w_c99f5ef,be261ab0.jpg
w_71764b4 w_3664a22 new_whale w_09e0cbf new_whale,be303576.jpg
new_whale w_dc89c4c w_dc89c4c w_f18df18 w_d66572d,be37dca2.jpg
new_whale w_640f91d w_e700deb w_750dc93 w_7c979d9,be3d38a5.jpg
w_024358d new_whale w_38ef4a3 w_89154d2 w_a29719a,be3dee76.jpg
w_94da90b w_29f00ae w_20c671c w_c8728f4 w_95c7d1b,be3e45b7.jpg
new_whale w_dfafffd w_fd9264d w_5317c46 w_9434f0c,be4224ad.jpg
w_c133ea8 w_1d4f970 w_1d4f970 new_whale w_aeaeeb5,be491462.jpg
new_whale w_eb0a6ed w_9151503 w_fea7fe6 w_7dee51b,be4e4a66.jpg
w_f5b8faf w_b9c9129 w_b9c9129 w_232e5bd w_c0560ac,be4e9fd7.jpg
new_whale w_42ab867 w_9321960 w_9321960 w_80171b9,be504f08.jpg
w_0869575 w_44f0fa2 w_569c2c7 w_d89b29e new_whale,be506dd8.jpg
w_74adf0b w_3326396 new_whale w_ad3dd0b w_36eb0b1,be54ca2d.jpg
w_bd65ef8 w_7e93962 w_78f2e92 w_da63cba w_7133c9d,be55009d.jpg
new_whale w_38de842 w_3e9d82e w_aca9607 w_eb8429c,be57ec90.jpg
w_38efc2d w_72b0d7f w_2a1d45c w_4408e45 w_d9055d1,be5d8646.jpg
w_dbbe0d4 w_5b8f282 w_fba3bde w_6dc88a6 new_whale,be5fa26b.jpg
new_whale w_6e8486d w_6e8486d w_8d83172 w_b08520c,be6858cb.jpg
w_d76d3bb new_whale w_d88da6d w_af04ba6 w_74adf0b,be68d1b5.jpg
new_whale w_b8236d6 w_abe383e w_ea4935f w_511c464,be6db05d.jpg
w_e826a6f w_8bc3f0a w_af98182 w_462a117 w_740dfd4,be811ebc.jpg
w_735ce7d w_4981cba w_ffa78a5 new_whale w_2071a4c,be81b5d1.jpg
w_f803b29 w_85f9040 w_95874a5 w_b33e728 new_whale,be880e23.jpg
new_whale w_46a4137 w_33fc58d w_a254eb0 w_cda5d6e,be8a4f25.jpg
new_whale w_12cdfbd w_79185c2 w_8b56cb1 w_a789d49,be8cf54f.jpg
new_whale w_4e03f66 w_09be3ad w_af04ba6 w_e02fe7b,be948472.jpg
new_whale w_9ca943b w_733fe81 w_8867074 w_6c899ff,be9b7cbb.jpg
w_9ba06bb new_whale w_a789d49 w_7f45825 w_6e7262e,be9b80e4.jpg
w_b9f5b8b w_88d11b1 w_3674103 new_whale w_7ad8bb3,be9cc3f5.jpg
new_whale w_67a3a92 w_c26f6db w_2196938 w_55c9a3b,be9db345.jpg
new_whale w_e88388a w_392bee3 w_da0f481 new_whale,bea0e5f3.jpg
new_whale w_dc7c5a0 w_19dc50f w_19dc50f w_e73d83c,bea2958e.jpg
new_whale w_c167245 w_02d5fad w_1957ab8 w_0de84f0,bea6d764.jpg
new_whale w_3e1ba5b w_1ecfe96 w_1ecfe96 w_49bbc79,bea78aee.jpg
w_89d9c03 new_whale w_fdcfcea w_eb39613 w_a2b8172,bea8e20d.jpg
w_69df882 w_69df882 w_62f804d w_44cccf6 w_48a98d7,beab9b77.jpg
new_whale w_7142b19 w_4378542 w_adc6e1b w_67de30b,bead0b7e.jpg
w_490c8a0 w_3172910 w_3172910 w_8867074 new_whale,beae652c.jpg
w_9ca943b w_9cb529f w_0beef28 w_2d29ddd new_whale,beb2798f.jpg
w_ebf3f26 new_whale w_ebf3f26 w_e8a8d85 w_23526cb,beb34407.jpg
new_whale w_b71eab2 w_74adf0b w_9874f0d w_af04ba6,beb356e1.jpg
w_d25a717 new_whale w_44cccf6 w_9771603 w_9771603,beb4ffee.jpg
w_5374a4c new_whale new_whale w_886257d w_886257d,beba1248.jpg
new_whale w_03f060f w_490b224 w_ade77e6 w_49b425b,bebfb75c.jpg
w_03a2ed7 w_afbc150 w_22bb9b3 w_b4d182b w_741861e,bec0023a.jpg
new_whale w_9146eae w_656ef35 w_56ddb00 w_e5edb40,bec10730.jpg
w_3197568 w_8166c79 w_2071a4c w_059e347 new_whale,bec7d327.jpg
w_8b56cb1 new_whale w_be9bf14 w_02facde w_2832e90,bec82230.jpg
new_whale w_23d3818 w_ef99fe9 w_d1917df w_e4f1fcc,bece170b.jpg
new_whale w_3c8eab1 w_0ad6137 w_0ebd514 w_9771603,bed16309.jpg
w_290f82b new_whale w_9146eae w_9146eae w_78f64d1,bed3698c.jpg
new_whale w_8464638 w_3745f59 w_8ba2066 w_ab4cae2,bedaf16a.jpg
w_e449d3a w_143b201 w_d10c9ff w_7d4cb72 w_17b33ae,bee0c45e.jpg
new_whale w_2184d07 w_70715c1 w_70715c1 w_37374fa,bee727ab.jpg
new_whale w_8431164 w_9db9ef5 w_223cebd w_5059889,beeb5896.jpg
new_whale w_11d8e5a w_abe383e w_3621c49 w_dc7c5a0,bef17e22.jpg
w_656afeb w_656afeb w_073b15e w_34c4927 w_e1431ba,bef44806.jpg
new_whale w_a837660 w_5f50b5e w_bb388ca w_bb388ca,bef46525.jpg
new_whale w_7c7a78c w_d6e437d w_7c7a78c w_9ca943b,bef58671.jpg
new_whale w_e4d3ec3 w_fdc8bf6 w_7ef90f7 w_0d48a7d,bef59987.jpg
new_whale new_whale w_994ff96 w_70715c1 w_7f3a122,bef6bd40.jpg
new_whale w_f19faeb w_8a2e496 w_b0362e2 w_f19faeb,bef6f900.jpg
w_ace8c54 w_c0d1701 w_91a96d8 new_whale w_cd1f1ed,befa211a.jpg
new_whale w_fb4d1f1 w_743209a w_4435e82 w_b8dff40,bf087d80.jpg
new_whale w_5e0e662 w_18eee6e w_3cf3853 w_a3dbc8f,bf08a2d1.jpg
new_whale w_1014df7 w_61cf42e w_2c46a73 w_fcf5284,bf0b2431.jpg
new_whale w_96fd936 w_125ba17 w_511c464 w_3565288,bf10387b.jpg
w_c926fc3 new_whale w_8376b7e w_fc433f7 w_1eaebf2,bf1afe12.jpg
w_b8fdb8e new_whale w_5919cf7 w_ca5f17f w_b9e00eb,bf1bfb17.jpg
new_whale w_c3d523d w_7351f46 w_fe49bc4 w_9ca943b,bf22576c.jpg
new_whale w_1eaebf2 w_540fd73 w_c39fceb w_540fd73,bf229b5e.jpg
new_whale w_ec67c71 w_afe57c6 w_a74742c w_01f211f,bf2de0b3.jpg
w_cd1f1ed w_63035d1 new_whale w_778ee6e w_fe49bc4,bf31b641.jpg
w_f18df18 w_95874a5 w_c0d494d w_03fcd5d new_whale,bf3ababc.jpg
new_whale w_1287fbc w_1287fbc w_12f2352 w_1287fbc,bf3b4ea7.jpg
w_1703ee5 new_whale new_whale w_1a70685 w_0e9f6d9,bf3c63e8.jpg
new_whale w_3e73d8a w_62c548b w_80c4153 w_9e1e278,bf3cc421.jpg
new_whale w_9df0865 w_fbce8b4 w_aeca19c w_8de6989,bf415388.jpg
w_bc5f0f5 w_fa32440 w_97f5054 w_222dcb7 w_3f907d6,bf417d4a.jpg
w_e2e56e9 w_9dcf002 w_6c803bf w_5c07f42 new_whale,bf46e16f.jpg
new_whale w_2f283f3 w_8ba2066 w_67de30b w_147b62b,bf47be96.jpg
w_b4ad62f w_ed67618 w_e0efc4f new_whale w_f02bf23,bf48bf51.jpg
new_whale w_dfbfe10 w_5dbe64d w_b29214f w_b29214f,bf48fe83.jpg
new_whale w_eb5b6aa w_414c24a w_c7efb86 w_28cd742,bf4f8287.jpg
new_whale w_b6e6392 w_b6689cc w_b6689cc w_c133ea8,bf52b5b8.jpg
new_whale w_5966fff w_1c6d5f0 w_9287bbb w_fd9264d,bf5c77c6.jpg
new_whale w_f792125 w_6b03eb4 w_1eafe46 w_7bf3a5c,bf5cdb38.jpg
w_8d83172 w_89f463f w_df092eb w_df092eb new_whale,bf5e5ff6.jpg
new_whale w_afed305 w_8327e8d w_53f79bc w_f0f0dbb,bf62412c.jpg
new_whale w_b9c9129 w_b9c9129 w_4fdaa2a w_2d99a0c,bf680d1a.jpg
w_1add6ae new_whale w_44cccf6 w_da2efe0 w_da2efe0,bf6fb4b6.jpg
w_7377b2b w_329e594 new_whale new_whale w_e4971dc,bf73cda9.jpg
w_b678944 w_7aaa569 new_whale w_b4732ef w_4ebeafb,bf78928b.jpg
new_whale w_a950d1c w_c0f3e88 w_da63cba w_3063bf4,bf7922b4.jpg
w_7b1686d w_74e15fc w_187e235 w_9caed77 w_9b3ed01,bf7c5f59.jpg
new_whale w_a8da4a3 w_e8a9fb8 w_a67a1bc w_279b255,bf7e9805.jpg
w_98baff9 w_d642d4e w_1f6e1db new_whale w_ee23a5f,bf81585c.jpg
new_whale w_e3c119c w_bb2d34d w_4378542 w_059df09,bf9094eb.jpg
w_3278f8c w_3278f8c w_eb8429c w_7e9dc07 w_d775542,bf956b67.jpg
w_2e42cc0 new_whale w_c6fceea w_a254eb0 w_ca5f17f,bf988930.jpg
new_whale w_29670e2 w_ce7c6c0 w_3572b44 w_bf77b13,bf9ef0ea.jpg
w_1f10750 w_6460698 w_09f825c w_09f825c new_whale,bfa258e9.jpg
w_a254eb0 new_whale w_41c0098 new_whale w_ba302c8,bfa9682f.jpg
w_0819271 w_1609b19 w_f19faeb new_whale w_cbedcb0,bfab9f18.jpg
w_5b45503 new_whale w_6193637 w_3449e4f w_993d66c,bfb02cdf.jpg
w_a8494ea w_3b90f9b w_17b33ae new_whale w_9c5ed68,bfb2636b.jpg
new_whale w_0467840 w_af98182 w_db2c158 w_fe87f0a,bfb47ad9.jpg
new_whale w_d37b55b w_38e088a w_4fd48e7 w_01687a8,bfbd5104.jpg
new_whale w_44cccf6 w_56bbc91 w_56bbc91 w_95874a5,bfc4ee42.jpg
new_whale w_7307089 w_69a9f72 w_52eecb4 w_1638016,bfcaf3b7.jpg
new_whale w_48c9deb w_19eb1b8 w_685466f w_6ef68ed,bfcf2ef8.jpg
w_b6886e5 w_c9e1cdc w_6485cd4 w_0408054 new_whale,bfd14fa5.jpg
new_whale w_09c1e0b w_7586198 w_8158b1f w_6e7b28b,bfd99b03.jpg
w_b729b1f w_338d945 w_fd07344 w_bb2d34d new_whale,bfdd59ce.jpg
new_whale w_8c1dab2 w_dd60c18 w_49bbc79 w_49bbc79,bfddf357.jpg
new_whale w_715d152 w_685466f w_f400702 w_07a425f,bfdfae98.jpg
w_c94f464 w_a06bdc4 new_whale w_796eebc w_099c712,bfe1624c.jpg
w_c786765 w_37223f9 new_whale w_2730966 w_3b02089,bfebfb2f.jpg
new_whale w_45aac7a w_540fd73 w_2ac83b0 w_7a8ce5a,bff022bd.jpg
new_whale w_ace8c54 w_ace8c54 w_f8c3a63 w_e02fe7b,bff4ca79.jpg
w_29eb3b2 new_whale w_cc5fae7 w_8a0192f w_3e0f25d,bff59886.jpg
w_5f0a14c new_whale w_3af4e73 w_3af4e73 w_11ca856,bff65826.jpg
w_626ef9f w_76390b4 w_db474c7 w_c84409b w_d68d206,c0049b2f.jpg
w_9e4a26f w_fe8233d w_6f31916 w_af04ba6 w_395d578,c0062d80.jpg
new_whale w_1add6ae w_45461e6 w_aa7e5f4 w_a494171,c007d544.jpg
new_whale w_118d911 w_7c6ad05 w_7c6ad05 w_9cb529f,c00ee113.jpg
new_whale w_08f1502 w_a33e1c3 w_5f8b9b9 w_c35b3ae,c015e347.jpg
new_whale w_c622a3f w_a779e16 w_871b1b9 w_9548fcf,c0161c01.jpg
new_whale w_9771603 w_63131a3 w_7879ee1 w_0ebd514,c01639f8.jpg
new_whale w_6c05e3b w_4378542 w_1eafe46 w_47d2bc6,c018632a.jpg
w_d708c5a w_d708c5a w_60c5e7e w_18a1bf2 w_d22af00,c01ff88a.jpg
w_1d84278 new_whale w_9875c12 w_656afeb w_c30959a,c020d27a.jpg
new_whale w_c5333e2 w_4b7b80b w_367b996 w_ee17a08,c021073d.jpg
w_516bedb w_6c803bf w_b3cc032 w_5eda687 w_1a70685,c0297849.jpg
w_a93c8f9 w_7554f44 w_7554f44 w_66c1b54 w_a18d0dc,c02ad851.jpg
w_f6c23d5 new_whale w_90ec71a w_b31d830 w_d430a71,c02b3fcf.jpg
w_1a29ba5 w_0c883eb w_8a438a4 new_whale w_dee1df3,c02c97df.jpg
w_ca813c2 w_212b985 new_whale w_7c18f3c w_3608443,c02d8dcd.jpg
w_f18df18 w_41ed8e8 new_whale w_0ce3ccc w_da2efe0,c0317da9.jpg
new_whale w_a3dbc8f w_cd1f1ed w_1dff010 w_569c2c7,c03527b2.jpg
new_whale w_9ceb05d w_987a36f w_987a36f w_dfbfe10,c036cd91.jpg
w_abc2eda w_ab6db0f w_9db9ef5 w_a6e8d03 new_whale,c037054c.jpg
w_f0f0dbb w_cdc21df w_e0818df w_e0818df new_whale,c038306f.jpg
w_b7d5069 w_576db5d w_14c8f15 w_f438375 w_b17f9ea,c0397dcc.jpg
new_whale w_8114b1b w_326e389 w_d1917df w_3320e76,c03ab705.jpg
new_whale w_607a734 w_1596a47 w_8376b7e w_2cde7c0,c042870d.jpg
w_fa121c9 w_9321960 w_ee17a08 new_whale w_813c5be,c043d7fa.jpg
new_whale w_97f5054 w_014250a w_014250a w_d9fdd15,c0456419.jpg
w_4f82020 w_9aeb18f w_1eafe46 w_e147c40 w_a19eecd,c046f500.jpg
new_whale w_7133c9d new_whale w_0caa554 w_993d66c,c0471d2e.jpg
new_whale w_a7202e1 w_b46bd60 w_e375961 w_5dddfbe,c047718a.jpg
new_whale w_0899118 w_c07f119 w_1dd8e68 w_fd6f24f,c047ba8e.jpg
new_whale w_8968506 w_c95a0ea w_79413a6 w_7554f44,c047ea72.jpg
w_eec1133 w_c027e4e w_5ad2030 new_whale w_e826a6f,c04949d6.jpg
new_whale w_5f9fd41 w_881f3c4 w_2730966 w_2282bb8,c04a2afe.jpg
new_whale w_5d2734c w_3572e7e w_3572e7e w_5d0666e,c04fb664.jpg
w_da9254f w_776ba6e w_d430a78 w_143b201 new_whale,c050e100.jpg
w_3172910 new_whale w_cae7677 w_3172910 w_4785de7,c05585d8.jpg
new_whale w_681dba6 w_5e78545 w_fd628f1 w_36eb0b1,c055932c.jpg
new_whale w_76048fe w_414c24a w_b99edea w_1cd9331,c0567c0b.jpg
w_0a565c5 w_5054c6a w_bc93e4a w_8cc9b05 w_694c109,c056b0c7.jpg
new_whale w_1eafe46 w_8397970 w_853c1f7 w_37374fa,c0595bba.jpg
w_a533837 new_whale w_c0d494d w_693c9ee w_c0d494d,c0597a1b.jpg
new_whale w_7600863 w_76d2cce w_92e7841 w_d6a6360,c05d68e0.jpg
new_whale w_a87ac93 w_dd90e0a w_7c943ab w_7c943ab,c05d7820.jpg
new_whale w_1e45a47 w_d663f4f w_4b7b80b w_67599af,c05e8f0c.jpg
new_whale w_2d963bb w_f4d89bb w_7914111 w_8a997b8,c0608b9f.jpg
w_be3c0f5 new_whale w_f3bd33a w_d0e5d1d w_d0e5d1d,c061bd6f.jpg
w_b8bfaf1 w_a7c6cf3 w_010a1fa w_e4d3ec3 w_ddf0c2c,c0628389.jpg
w_8d46cef w_8d46cef new_whale new_whale w_813c5be,c064ec31.jpg
w_881f3c4 w_53ef628 w_04c1951 w_cc8241b new_whale,c069a9cc.jpg
w_0819271 w_1609b19 w_f19faeb new_whale w_cbedcb0,c06d7410.jpg
new_whale w_059e347 w_7437489 w_41ed8e8 w_13c6b6b,c073f468.jpg
new_whale w_07fea3d w_e8bce8a w_f7e6199 w_6202983,c074ee3a.jpg
w_92d55a6 w_8cd3036 w_ee17a08 w_662a132 w_aed6a9a,c07645c8.jpg
new_whale w_2b3fe8e w_064ab78 w_798bf53 w_85b0d73,c07b246c.jpg
new_whale w_dbda0d6 w_23cd105 w_c5f9e78 w_d11c53b,c0839d94.jpg
new_whale w_f79b3f9 w_7edcfa5 w_0ac9006 w_53e9072,c0876efa.jpg
new_whale w_7f5f0c9 w_c241e72 w_3e0f25d w_31d3999,c08886b3.jpg
new_whale w_9321960 w_3694c7d w_3694c7d w_f022f78,c08aac97.jpg
new_whale w_9e1e818 w_8c1ec28 w_ab4cae2 w_4b7b80b,c08c255e.jpg
new_whale w_6e8486d w_6e8486d w_8d83172 w_b08520c,c08c2b66.jpg
new_whale w_0a71e87 w_0a71e87 w_03a2ed7 w_d398969,c09111d1.jpg
new_whale w_434ad6a w_d9adb4f w_41ed8e8 w_b618751,c0916b3e.jpg
w_9562910 w_61b5906 new_whale new_whale new_whale,c0952997.jpg
w_9d2ded8 w_77e1d3f w_24a2923 new_whale w_51652ee,c0979ce9.jpg
w_662a132 w_a3d72f9 w_6635a97 w_a2a1378 w_7db10cc,c0a06c27.jpg
new_whale w_b3e6069 w_b3e6069 w_081dd6e w_081dd6e,c0a0db35.jpg
new_whale w_179ffe3 w_a71b714 w_95c7d1b w_e282300,c0a214c1.jpg
new_whale w_9122e43 w_a5a13d0 w_9ca943b w_9d0e84a,c0a24ac8.jpg
new_whale w_75780a0 w_ba0d756 w_ea2385d w_932c8cd,c0a2ea2e.jpg
new_whale w_1e75406 w_2b930da w_f3d98bc w_4fe4078,c0a97327.jpg
new_whale w_ea2385d w_3d0bc7a w_3d0bc7a w_75780a0,c0ab78ee.jpg
w_22f0a7d w_cdc0a1c w_04c1951 new_whale new_whale,c0af6009.jpg
w_f18df18 w_41ed8e8 new_whale w_6af9dd7 w_9e1e818,c0b0c6c2.jpg
new_whale w_98baff9 w_8aab1d4 w_2c3f440 w_7e8b270,c0b3d574.jpg
new_whale w_a254eb0 w_d8e752e new_whale w_f79563e,c0b602d8.jpg
new_whale w_6c803bf w_8b2cc42 w_e2e56e9 w_2f283f3,c0b9d163.jpg
w_ca813c2 w_da1cc7a w_67de30b w_be9bf14 w_2cb8996,c0ba05d9.jpg
w_7c943ab w_b17f9ea new_whale w_fd07344 w_4378542,c0bdee62.jpg
w_7a95674 new_whale w_19ca2c6 w_f7bf28d w_d32adcd,c0c236ef.jpg
new_whale w_38efc2d w_dfbfe10 w_4a78bf2 w_743209a,c0c25e93.jpg
w_04c1951 w_53ef628 new_whale w_a8ec52f w_e449d3a,c0c8a037.jpg
new_whale w_48bcad8 w_8309df3 w_28ce17c w_28ce17c,c0ca04a0.jpg
new_whale w_ef6e6a9 w_4a074b8 w_2b443f8 w_2b443f8,c0ca867d.jpg
new_whale w_b7d5069 w_ee17a08 w_f3bd33a w_0fce9a3,c0ca9eda.jpg
new_whale w_06972d2 w_6092d5c w_f81c626 w_ab2d17a,c0d44c6a.jpg
new_whale w_ccbc782 w_74adf0b w_014a645 w_cb7b682,c0d7bfe6.jpg
w_d0e5d1d w_d0e5d1d w_b17f9ea new_whale w_498bf0d,c0d7ff2f.jpg
w_d59cb45 w_4ebeafb w_469f571 w_17ee910 w_e8778ce,c0de954f.jpg
w_ecb9a79 new_whale w_3e02970 w_3e02970 w_7e1521a,c0e0399c.jpg
new_whale w_230a0de w_1596a47 w_03c6d18 w_1287fbc,c0e51022.jpg
w_372909c w_af6c7e2 w_2111212 new_whale w_7ad8bb3,c0e710c9.jpg
new_whale w_98ab48e w_eb39613 w_9c5ed68 w_8044362,c0e8baaf.jpg
new_whale w_fb94a5a w_b074cdf w_c1b685f w_2ac83b0,c0ec44af.jpg
w_376a413 w_3a9ee71 w_db5cc79 w_db5cc79 w_d22af00,c0edc059.jpg
new_whale w_ea2385d w_ea2385d w_c9e1cdc w_6c803bf,c0ee72d7.jpg
new_whale w_8e97748 w_a54e7c1 w_43be268 w_a14ccaa,c0f7174f.jpg
new_whale w_d36f58c w_91e86c4 new_whale w_4439f3d,c0fa1c25.jpg
w_3aa2073 w_136337c w_0d733a5 new_whale w_d3c8520,c0fef7c6.jpg
new_whale w_71c7322 w_813c5be w_987a36f w_b729b1f,c1000a76.jpg
new_whale w_aca9607 w_80e649e w_87e00c8 w_8d5ede1,c10ac906.jpg
new_whale w_c58b474 w_f932abc w_ed5a7c6 w_25fdcfb,c10b1ad6.jpg
new_whale w_d94c323 w_d94c323 w_462a117 w_462a117,c10bebcf.jpg
new_whale w_1aa512b w_1aa512b w_b4eeae6 w_193b7e3,c10ca95a.jpg
new_whale w_81b402a w_65428d9 w_65428d9 w_693c9ee,c110fcc4.jpg
w_a494171 w_45461e6 w_3d66298 w_3d66298 new_whale,c1117fca.jpg
new_whale w_63131a3 w_29d2cec w_9771603 w_1c3cecd,c113e525.jpg
w_8d83172 w_1cca86d w_6ef68ed w_9ea2cc3 w_6c803bf,c11b57af.jpg
w_0ead9d7 w_6384242 w_2ac8b4d w_a01d903 w_a58f64d,c120adb6.jpg
w_2a1d45c new_whale w_a2a1378 w_853c1f7 w_35c8057,c1228693.jpg
new_whale w_7879ee1 w_46193da w_be32bec w_fd1cb9d,c12524f5.jpg
new_whale w_7554f44 w_b4732ef w_4195fc3 w_243e33e,c1286168.jpg
new_whale w_f81c626 w_f18df18 w_1c32062 w_7311fe4,c1350753.jpg
w_56bbc91 w_56bbc91 w_3fe1eb9 w_3fe1eb9 new_whale,c1373688.jpg
w_0e4ef50 new_whale w_3674103 w_964c1b3 w_410fb0a,c13a81cf.jpg
new_whale w_cc759cd w_0087fdd w_f1b565a w_f1b565a,c1412cd1.jpg
new_whale w_ff5538f w_824f286 w_a533837 w_125095f,c141799d.jpg
w_23cd105 new_whale w_02a768d w_dd5df89 w_1a9a38e,c14461e4.jpg
new_whale w_4f217e3 w_56f2b1e w_86cc90f w_ce29d2a,c148b89f.jpg
new_whale w_3039e7a w_d4eb9ed w_6e42b8e w_cf00b01,c149947b.jpg
w_5021993 w_99c07e8 w_f4d89bb new_whale w_18a1bf2,c14d8c55.jpg
new_whale w_3d0bc7a w_d915632 w_12f2352 w_895c722,c150223a.jpg
new_whale w_a0149f9 w_a8335f2 w_0acce53 w_5021993,c1517620.jpg
w_8b15b96 w_9412d1b new_whale w_fe424c3 new_whale,c152b9f1.jpg
w_b96c08e w_697c72e w_447643b w_0c8a724 new_whale,c152e3cd.jpg
new_whale w_05ecba5 w_4a7080a w_0e737d0 w_9c4bb3c,c15391ed.jpg
w_c74ab24 new_whale w_3355365 w_2a04ceb w_b5e3076,c154d1ed.jpg
new_whale w_c39c56e w_be20b46 w_fce6ab2 w_76ebad6,c156e5e2.jpg
w_acc67ea new_whale w_bf4880a w_a91600a w_1609b19,c158cf7b.jpg
w_8459e39 w_8459e39 w_4b8d0c9 w_6a4e5f2 w_104cc93,c15a0b62.jpg
new_whale w_ee17a08 w_cd88a48 w_8fab53d w_43be268,c15bd982.jpg
new_whale w_d37b55b w_38e088a w_4fd48e7 w_01687a8,c15c2f13.jpg
w_d398969 new_whale w_8867074 w_8867074 w_35f0fd9,c1622f83.jpg
new_whale w_fac9864 w_fd3e88d w_f803b29 w_2482b4a,c16ddc23.jpg
new_whale w_41d32aa w_9c8e377 w_5ba417d w_0e4f53c,c170a2a1.jpg
new_whale w_ea99623 w_69e88da w_5ba417d new_whale,c17812c6.jpg
w_a31aa30 w_865c2ba w_f031837 w_127f4c6 new_whale,c179189d.jpg
new_whale w_9434f0c w_5317c46 w_dfafffd w_d80e1bc,c17cf54b.jpg
w_e62680c w_c280a12 w_2111212 w_7e4d894 new_whale,c181b0ce.jpg
w_b5383b5 w_e39dcea new_whale w_b6886e5 w_ca813c2,c181e81d.jpg
new_whale w_c10ffe9 w_f438375 w_0de84f0 w_4e68ddc,c1863f50.jpg
new_whale w_95874a5 w_286ec5f w_f64658b w_c133ea8,c186b1ab.jpg
new_whale w_bcb0696 w_7b1eaa6 w_b05c57f w_b05c57f,c191db34.jpg
new_whale w_0103030 w_7b442c4 w_a74742c w_c2ea3f0,c19618ce.jpg
w_fd1cb9d w_0378699 w_38e4aae w_69f4311 new_whale,c199b095.jpg
w_0fea5a3 w_e00a916 w_0fea5a3 w_db474c7 new_whale,c1a52535.jpg
new_whale w_977d881 w_3a78626 w_2d2d7fe w_099ab25,c1a78842.jpg
w_c3aaa3a new_whale w_f0f0dbb w_5f54bf3 w_9967edd,c1b4a98c.jpg
w_97f5054 w_1f09cdd new_whale w_dc89c4c w_3d0bc7a,c1bb5dba.jpg
new_whale w_d89b29e w_b6886e5 w_b6886e5 w_11adaae,c1c3601a.jpg
w_52b06b1 new_whale w_52b06b1 w_ee17a08 w_8861715,c1cf8577.jpg
new_whale w_5a6bf1f w_666b072 w_6f580eb w_63db6f9,c1d27e92.jpg
new_whale w_27736a0 w_0013924 w_cef1b93 w_c13a4e3,c1d42426.jpg
new_whale w_a14a253 w_c3ff6f2 w_9434f0c w_12c3d3d,c1da857c.jpg
new_whale w_1638016 w_1638016 w_593485f w_449503f,c1e8256b.jpg
w_1d0540c w_6d90f45 w_6d90f45 w_dcb4be9 w_a3abc56,c1ea2d16.jpg
w_7f81114 w_d7d60f9 w_cd02407 w_d3ce445 w_1ae1386,c1ec42f9.jpg
new_whale w_3026ce2 w_e156c87 w_1add6ae w_da63cba,c1ee10aa.jpg
w_2e10179 w_5d96ba4 w_5d96ba4 new_whale w_9548fcf,c1f07a23.jpg
w_c63fdb6 new_whale w_1029f4e w_38a3f72 w_92c7ace,c1f9412b.jpg
w_4d358e5 w_76b6f7c w_76b6f7c w_5d0666e w_7923fdc,c204f003.jpg
w_494dd45 new_whale w_639aed5 w_5a29f9d w_efe57c7,c207b3ed.jpg
new_whale w_08d1ccd w_feab6f3 w_9d83b4d w_18a1bf2,c208a718.jpg
w_1ecfe96 w_1ecfe96 w_56bbc91 w_eb47189 w_531d2e5,c20993aa.jpg
new_whale w_19aeb9c w_af6c7e2 w_eaeb1f0 w_fa473e6,c209acd4.jpg
new_whale w_b6ed5d2 w_b6ed5d2 w_38de842 w_ae07541,c20aedf9.jpg
w_2c55303 new_whale new_whale w_dcb1f2a w_19dc50f,c20edd61.jpg
w_da9254f w_3674103 new_whale w_69e88da w_8fac7da,c2134ac7.jpg
w_f369a80 new_whale w_e4d3ec3 w_010a1fa w_8a2793e,c215641d.jpg
new_whale w_a8ec52f w_15c39f4 new_whale new_whale,c21cf77c.jpg
new_whale w_be32bec w_7879ee1 w_0a97a25 w_e45bc18,c21dfba3.jpg
new_whale w_7554f44 w_da2efe0 w_cf0c062 w_7554f44,c220cf8f.jpg
new_whale w_1eafe46 w_1eafe46 w_d1eab36 w_a9dd349,c2214eb6.jpg
w_c0d494d new_whale w_fa32440 w_fa32440 w_c0d494d,c22358de.jpg
new_whale w_314d77b w_46b211d w_62d76c2 w_8c605d2,c2261e95.jpg
w_a528ab1 w_efd3f81 w_9eeb05c new_whale w_73cbacd,c2277099.jpg
new_whale w_29670e2 w_02d5fad w_f8e6546 new_whale,c22806fd.jpg
new_whale w_ca27f31 w_414f402 w_6710cf8 w_79d4855,c22bc176.jpg
w_994ff96 new_whale w_dce3192 w_19eb1b8 new_whale,c22c8dff.jpg
new_whale w_e94a3b2 w_c17a537 w_989fbbb w_7875b79,c22f9ec4.jpg
new_whale w_d32adcd w_cd65880 w_414c24a w_76048fe,c231cffc.jpg
new_whale w_dbda0d6 w_23cd105 w_8392ae9 w_b318111,c232786a.jpg
new_whale w_44f0fa2 w_11adaae w_c48ad3e w_569c2c7,c2356d11.jpg
new_whale w_e8ae8c1 w_f19faeb w_a8494ea w_f19faeb,c23d710d.jpg
w_5b5a85d w_cd65880 w_515838e w_c06dd6e new_whale,c2472a0a.jpg
w_0475042 w_2c55303 new_whale w_3f90907 w_3f90907,c247ec96.jpg
w_dd76ce2 new_whale new_whale w_dd76ce2 w_5824675,c24c3792.jpg
w_db5cc79 w_db5cc79 w_83034c7 new_whale w_dd52cfc,c252320e.jpg
new_whale w_0ebd514 w_59eb8ae w_514c62c w_a22f338,c252c56b.jpg
new_whale w_7554f44 w_7554f44 w_7554f44 w_f438375,c255ebe0.jpg
new_whale w_0e4f53c w_e30e97f w_e30e97f w_2e872af,c269370b.jpg
new_whale w_5bc5fc1 w_741861e w_243e33e w_4403803,c2727ef1.jpg
w_6c42496 w_84a13d3 w_711d58c w_441bd21 new_whale,c27e70eb.jpg
w_ee17a08 new_whale w_fa121c9 w_3694c7d w_3694c7d,c27fb9a0.jpg
new_whale w_d148982 w_2e872af w_e449d3a w_04c1951,c288c2da.jpg
new_whale w_444a844 w_556df30 w_2581f2e w_279b255,c288c81d.jpg
new_whale w_44a6b62 w_35063ed w_693c9ee w_1f00cb7,c28ae128.jpg
w_8db45b7 w_1875b28 w_2ffed9c new_whale w_fe2742d,c28b1f8e.jpg
new_whale w_78f2e92 w_817f022 w_4d528e4 w_945aefe,c292553f.jpg
w_b6886e5 w_59eb8ae new_whale w_2f97ce6 w_7f40920,c298788c.jpg
w_76ebad6 w_fe054f3 w_7377b2b new_whale w_be20b46,c2991c94.jpg
new_whale w_29670e2 w_f8024be w_552a16e w_51cdd4b,c29b74a4.jpg
new_whale w_a06bdc4 w_540fd73 w_4855bd3 w_8b56cb1,c2a088c9.jpg
new_whale w_40323ac w_8a0192f w_5bdb7c2 w_c13b4e6,c2a839af.jpg
w_dbda0d6 w_3050553 w_530f87b new_whale w_6a2c07f,c2aca18f.jpg
new_whale w_0ac9006 w_d314904 w_7a95674 w_f68d0af,c2b1f0cb.jpg
w_b5e3076 w_2a04ceb w_5f50b5e w_5f50b5e w_6202983,c2ba67f8.jpg
new_whale w_8cf18ac w_76106aa w_d234e6b w_861cc1c,c2bb3dd9.jpg
new_whale w_aa9b995 w_33e89be w_43be268 w_cb9220b,c2bfc6c7.jpg
new_whale w_bb2d34d w_71e6583 w_44cccf6 w_44cccf6,c2c0e38b.jpg
new_whale w_a8e5d39 w_39776da w_44cccf6 w_44cccf6,c2c1e399.jpg
new_whale w_2863d51 w_67de30b w_a3cd405 w_54c00ad,c2c7d97e.jpg
new_whale w_e09e886 w_1ec267f w_2dae424 w_c57623d,c2ca6d9e.jpg
new_whale w_660195e w_b6886e5 w_703e39b w_703e39b,c2d093fe.jpg
new_whale w_2901dbf w_2ea9744 w_e61dd6d w_3d66298,c2d431a3.jpg
new_whale w_68b47a1 w_8bcf29b w_d67071c w_db0ad01,c2d68d63.jpg
new_whale w_d3c8520 w_91faa95 w_30cf2ca w_ef99fe9,c2d76c35.jpg
new_whale w_e6b3dd4 w_0b7e949 w_3326396 w_1638016,c2d80f7b.jpg
new_whale w_1287fbc w_1287fbc w_b64126b w_aa16da4,c2da8bb3.jpg
w_5a29f9d w_11adaae w_11adaae w_17cb04d new_whale,c2e1f33b.jpg
new_whale w_b0e05b1 w_74e15fc w_e0f6444 w_6ae1eaf,c2e5a6a8.jpg
new_whale w_da0b8b5 w_e59a1f0 w_34c4927 w_da0b8b5,c2ea223b.jpg
new_whale w_3fdab94 w_a789d49 w_17e8554 w_771136b,c2ebc0eb.jpg
w_fd1cb9d new_whale w_cb7d1b5 w_e158680 w_718ce15,c2ecbc6e.jpg
w_3197568 w_ed69e9c w_b38374a new_whale w_9ca943b,c2f8a453.jpg
new_whale w_7276f4b w_589b830 w_9091ae6 w_c6f1bff,c2fe55db.jpg
new_whale w_8329cea w_c39fceb w_bbe06a7 w_507e610,c300467a.jpg
new_whale w_3d4900b w_5f7c402 w_80245ee w_3d66298,c3043a50.jpg
w_685466f new_whale w_ccc8e31 w_44cccf6 w_b9ee5ec,c3050651.jpg
new_whale w_3c8eab1 w_94b4478 w_f7a0fd7 w_462a117,c309d7af.jpg
w_8d46cef w_372ae75 w_372ae75 w_95874a5 new_whale,c30dd013.jpg
new_whale w_642de28 w_64f3545 w_694c109 w_4a9ee0f,c30f2145.jpg
new_whale w_06f0fd3 w_fb72090 w_21e178f w_92d390e,c31631c1.jpg
new_whale w_aa67f17 w_78f2e92 w_bbd9409 w_d6f3d24,c316c4a5.jpg
w_530f87b w_0e25cf2 w_dd5df89 w_8867074 w_43966a3,c3193596.jpg
w_ba39446 w_86113c4 new_whale new_whale w_2c55303,c31e3d5e.jpg
new_whale w_d52bc74 w_883557a w_77fbe5c w_3fc3d07,c3253385.jpg
w_ab4cae2 w_86113c4 w_44f1d84 new_whale w_f18df18,c32b75c0.jpg
new_whale w_9d136ff w_abc2eda w_3f90907 w_3f90907,c32e9b6b.jpg
w_62ca7c8 w_511c464 w_b7d5069 w_b0e05b1 w_ee17a08,c32f903c.jpg
new_whale w_ae07541 w_92c7ace w_df092eb w_b33e728,c33144e2.jpg
new_whale new_whale w_1a70685 w_b729b1f w_3fe1eb9,c338aa58.jpg
new_whale w_1eafe46 w_f64cf8a w_f663b5e w_c57623d,c3398097.jpg
w_9b6b87d w_8fac7da w_a1e017f w_fcff830 w_6d17527,c33fff9f.jpg
new_whale w_f3f84d7 w_eac205a w_a18d0dc w_f19faeb,c34baad5.jpg
w_b39c722 new_whale w_0853262 w_6547e12 w_4403803,c34ef3bc.jpg
