Id,Image
new_whale w_d1917df w_ffbd74c w_ab39440 w_b9df6da,00029b3a.jpg
new_whale w_76d84e2 w_80245ee w_c99f5ef w_6dd7c3d,0003c693.jpg
new_whale w_8b56cb1 w_4855bd3 w_816d344 w_d3ed80e,000bc353.jpg
w_d9adb4f w_7285eb3 new_whale w_8c1ec28 w_e62a48d,0010a672.jpg
new_whale w_18eee6e w_6c803bf w_7c44934 w_bb2d34d,00119c3f.jpg
new_whale w_679f2eb w_48a5b86 w_48a5b86 w_c3aaa3a,001259cc.jpg
w_3d66298 w_e156c87 w_c0f3e88 new_whale w_e02fe7b,0015f9b4.jpg
new_whale w_daf1085 w_87e00c8 w_89e159a w_6a3210a,0018c4ba.jpg
new_whale w_0fce9a3 w_a38d1a3 w_8bde95b w_6af9dd7,001bf484.jpg
new_whale w_4b950da w_0ac9006 w_f79b3f9 w_544d0c1,002d8d81.jpg
new_whale w_edcb241 w_efd3f81 w_d22af00 w_86b3f04,00342aa2.jpg
w_89317b0 new_whale w_414f402 w_44f0fa2 w_853c1f7,00367faf.jpg
w_9122179 new_whale w_a494171 w_45461e6 w_e156c87,003abee6.jpg
w_3e4bb3f new_whale w_02facde w_814a588 w_f2e9055,003ac3da.jpg
new_whale w_7285eb3 w_7f6ce8e w_8141223 w_e3caa40,003be4bf.jpg
new_whale w_540fd73 w_73d5489 w_3af4e73 w_552a16e,003e42df.jpg
new_whale w_1e31d24 w_2ac6dd5 w_0f2f6e6 w_656ef35,004cd940.jpg
new_whale w_c493795 w_bc9dc37 w_b70a0c4 w_6affb63,0051ef38.jpg
w_38a3f72 new_whale w_ca27f31 w_6e47e0e w_865c2ba,0056000b.jpg
w_8533569 new_whale new_whale w_da6d50b w_b7d5069,005d5f4f.jpg
w_654a5bb w_acc67ea w_95874a5 w_13c6b6b w_95874a5,0067109a.jpg
w_82e0d98 w_c751211 new_whale w_4b33077 w_7419e4b,006affcc.jpg
w_d8f848c w_e0f1df1 w_715d152 new_whale w_89317b0,00701cff.jpg
w_b3655a6 w_c5d7c03 w_39776da w_97f5054 new_whale,007b353c.jpg
w_18eee6e w_1948625 new_whale w_8b2cc42 w_aaf443d,0087b1bf.jpg
w_d6856ab w_934736d w_67de30b new_whale w_1c3cecd,008a0615.jpg
new_whale w_2f07b15 w_5f82501 w_97e7648 w_5f82501,008be392.jpg
new_whale w_6438b7d w_63db6f9 w_b41e229 w_853c1f7,00944069.jpg
new_whale w_7554f44 w_7554f44 w_7554f44 w_7554f44,009a4db9.jpg
w_279b255 w_2581f2e w_556df30 w_034a3fd new_whale,009c3b60.jpg
new_whale w_ade77e6 w_219e33c w_76d5723 w_f7a0fd7,009fe2db.jpg
new_whale w_17136dc w_bbf20b4 w_50d2084 w_f86488a,00a5f43e.jpg
new_whale w_0626e4d w_93dcf76 w_25871da w_25871da,00a716d3.jpg
new_whale w_8f6b207 w_7dee51b w_2d09595 w_eb0a6ed,00ac0428.jpg
new_whale w_5a81425 w_0c6d50d w_c053b99 w_9c8e377,00ae107b.jpg
w_3411b9f w_db2baec new_whale new_whale new_whale,00aec561.jpg
new_whale w_9146eae w_656ef35 w_681dba6 w_1e31d24,00b0d279.jpg
w_97f5054 w_dc89c4c w_cf3a12e w_95874a5 w_e3c119c,00b436ee.jpg
new_whale w_435ee6d w_423e872 w_715d152 w_e1431ba,00b55e23.jpg
new_whale w_143b201 w_143b201 w_f178867 w_5dc1c2d,00b75461.jpg
w_1911cbb new_whale w_656afeb w_56bbc91 w_56bbc91,00ba8a1f.jpg
new_whale new_whale w_7311fe4 w_3ee8570 w_3ee8570,00c6a099.jpg
w_5ae47d9 w_7abaf06 w_24bdae3 w_a4f1419 new_whale,00ce5ca3.jpg
w_5a81425 w_1dd8e68 new_whale w_b5ea8a0 w_5cb5fc3,00dfd1df.jpg
new_whale w_62c3998 w_fb2c3fb w_8b1cd49 w_20e863f,00e24ca4.jpg
new_whale w_3a7d86d w_3350425 w_a846944 w_8d83172,00e957d5.jpg
new_whale w_1894a1c w_cad1a8d w_80bae3a w_cc22f68,00ec6537.jpg
w_f03ca16 new_whale w_ffda8b2 w_ffda8b2 w_3e0f25d,00f6144a.jpg
w_3694c7d w_cd3e1bd w_9c449e2 w_9c449e2 new_whale,00f8a2e9.jpg
new_whale w_c6bd2bb w_681dba6 w_fce6ab2 w_90201e3,00fb828f.jpg
new_whale w_1da7080 w_8459e39 w_8459e39 w_9205d40,00fbb200.jpg
w_1aa0526 w_dd60c18 new_whale w_5dbe64d w_6132293,00ff0cb6.jpg
w_9b401eb w_9b401eb w_9b401eb w_5b576a0 new_whale,01039b00.jpg
new_whale w_caf4286 w_41f0a7e w_affdf5d w_099ab25,0112cd97.jpg
new_whale w_e7a238b w_e7a238b new_whale w_7759db0,011ecf53.jpg
w_2b4da16 w_d62128e new_whale w_18df014 w_18df014,011fc871.jpg
w_7049d9f new_whale w_655bba3 w_fd1cb9d w_735d8a4,0126c54c.jpg
w_38e4aae w_1b1c4f1 w_62f804d new_whale w_38efc2d,0128d810.jpg
w_9868b95 w_f986587 new_whale w_d5ec83f w_e39dcea,012acadb.jpg
new_whale w_3d66298 w_147b62b w_9db9ef5 w_147b62b,012d4493.jpg
w_f86488a new_whale w_43be268 w_7895123 w_17136dc,012e93ba.jpg
w_83034c7 w_eb0a6ed w_e41fd4f w_fe424c3 w_7632107,0136c1f0.jpg
w_20ba84b new_whale w_6ee7470 w_adeee48 w_37223f9,0140ff79.jpg
w_28cd742 new_whale w_414c24a w_c4c8491 w_c4c8491,01485623.jpg
w_be3c0f5 w_17e8554 w_24212f5 w_b17f9ea new_whale,014f440a.jpg
new_whale w_4e1f7bd w_8286350 w_96b697f w_7b035cc,0150a115.jpg
w_f4e0748 new_whale w_9ca943b w_9ca943b w_f4e0748,0155fbc9.jpg
new_whale w_588d5d7 w_0c6d50d w_62ec01b w_9e862ac,015a5e61.jpg
new_whale w_a59905f w_0beef28 w_4103f39 w_0beef28,016003f6.jpg
w_2d2de1d new_whale w_9890432 w_5dcbb74 w_2a1d45c,016672a3.jpg
new_whale w_d5ec83f w_d5ec83f w_6dc88a6 w_5b8f282,0167d802.jpg
w_693c9ee new_whale w_8f3cb68 w_ed5a7c6 w_c0d494d,016ed817.jpg
new_whale w_296749b w_a3cd405 w_0e737d0 w_a5a13d0,017019a1.jpg
new_whale w_540fd73 w_6c899ff w_c87c10b w_cd4b506,018541f1.jpg
w_4a17405 w_a8f9a1e w_6b7d5ad w_1e5a146 new_whale,018b5757.jpg
new_whale w_73cbacd w_3bb210a w_3bb210a w_8697f5f,01915f36.jpg
new_whale w_efd3f81 w_1fd0d0e w_721d2e9 w_4e68ddc,0192e574.jpg
new_whale w_c80d300 w_c8728f4 w_be20b46 w_30cf2ca,01abfb64.jpg
w_2d99a0c w_8d3b8b6 new_whale w_987a36f w_987a36f,01ac69d4.jpg
new_whale w_c95a0ea w_95874a5 w_7c943ab w_7c943ab,01adb909.jpg
new_whale w_fb72090 w_2c19c4a w_4f0b7d9 w_60eba40,01c4bb57.jpg
w_cb32cb8 w_49bbc79 new_whale w_c133ea8 w_b6e6392,01c8a16d.jpg
w_303518a w_303518a w_73d5489 w_5dfafa5 w_35063ed,01c94ce7.jpg
new_whale w_a048f26 w_9874f0d w_a254eb0 w_44cb3ee,01cd27f0.jpg
new_whale w_bd65ef8 w_7133c9d new_whale w_afe953f,01d2ff07.jpg
new_whale w_7c7a78c w_23e4e61 w_0beef28 w_9ae554b,01d73f5e.jpg
w_5e57e8b new_whale w_72e70e5 w_9caed77 w_735675e,01d7717e.jpg
new_whale w_b856fc1 w_3f90907 w_3f90907 w_9b401eb,01dfcf78.jpg
new_whale w_ceffa10 w_f0a2e40 w_9f718e8 w_392bee3,01e59a32.jpg
w_6e47e0e w_6e47e0e w_38e4aae w_5624f08 w_0378699,01e63369.jpg
new_whale w_3d0bc7a w_3449e4f w_33b9360 w_43b50e5,01ea0d73.jpg
new_whale w_a14d6d8 w_1c6d5f0 w_24bdae3 w_fd9264d,01eb30a7.jpg
w_011d4b5 w_ace8c54 w_2ea9744 w_91572bb new_whale,01f62722.jpg
w_5f50b5e w_6c9aa21 w_18bd7b3 new_whale w_ca56bf3,02011e3d.jpg
w_7fe3551 w_b033b36 new_whale w_e0e5c9e w_4f37147,0201ce77.jpg
w_686408a w_73d5489 w_04c1951 w_73d5489 new_whale,0203618e.jpg
new_whale w_3cf3853 w_a3dbc8f w_4a78bf2 w_4a78bf2,0206b1f5.jpg
new_whale w_a1350a7 w_c128384 w_ceffa10 w_39a31a8,020d17d0.jpg
w_699be3a new_whale w_29670e2 w_1746c88 w_238a4ad,02168b0b.jpg
w_4e2652d new_whale w_95c7d1b w_406331a w_20c671c,0219526e.jpg
new_whale w_a56d9ff w_51652ee w_ec853f1 w_91b5f87,021e3c88.jpg
new_whale w_e39371c w_9ad963f w_ebf9290 w_0d60fdd,021eb64f.jpg
w_4cedbf8 new_whale w_24823e2 w_329e594 w_c663985,021f07cc.jpg
w_d36f58c new_whale w_22bcbd6 w_993d66c w_993d66c,022cd8bf.jpg
w_b5d8846 w_b20763e new_whale w_49308df w_71f6bc5,022e4158.jpg
w_91c0a1d w_be4d5b8 w_6dbb861 w_5f9508d w_5f9508d,023f867b.jpg
w_83714b7 new_whale w_a8bc2bc w_9e862ac w_7158e92,024b37ba.jpg
w_2b930da new_whale w_5415fcb w_e94d02c w_0122d85,024b79f1.jpg
w_df092eb new_whale w_8534390 w_df092eb w_59eb8ae,024f3234.jpg
new_whale w_35d4d83 w_f03ca16 w_f03ca16 w_eff7e35,02555b2a.jpg
new_whale w_69185bb w_462a117 w_462a117 new_whale,025b6efb.jpg
w_76387b4 w_fd1cb9d new_whale w_540fd73 w_91d9cd0,0262da48.jpg
w_9122e43 w_f5cc2fd w_da1cc7a w_b88a8d8 new_whale,0265f1cc.jpg
new_whale w_5f7c402 w_de51d16 w_576db5d w_3d66298,02662d4c.jpg
w_2957331 new_whale w_5624f08 w_fa32440 w_794effc,0266c5b9.jpg
new_whale w_11c2836 w_1addcc2 w_797e546 new_whale,02678304.jpg
new_whale w_e9ac2a8 w_2e4fecc w_83e0203 w_2b0028d,0272edb8.jpg
new_whale w_1b1c32f w_e449d3a w_136337c w_c4f3619,02740bf3.jpg
new_whale w_eb39613 w_98ab48e w_9c5ed68 w_97e7648,027a214c.jpg
new_whale w_bf69a19 new_whale w_9b401eb w_831f124,0281dcb3.jpg
new_whale w_5f0a14c w_5f0a14c w_3af4e73 w_7f40920,02820868.jpg
new_whale w_987a36f w_f90b695 w_6f211a9 w_3cf3853,028b76df.jpg
w_57186e5 new_whale w_0ebd514 w_d3ef4b2 w_030294d,02931ea9.jpg
new_whale w_b729b1f w_f2e9eb1 w_813c5be w_af5d11a,029e1433.jpg
new_whale w_338b130 w_3698eaf w_0d85e59 w_2a32d3d,02a0fc46.jpg
new_whale w_8b56cb1 w_79185c2 w_4fcfa4d w_4fcfa4d,02a236a7.jpg
new_whale w_242a05d w_242a05d w_da2efe0 w_3e73d8a,02a30984.jpg
new_whale w_49bbc79 w_02facde w_fe2742d w_49bbc79,02b08c12.jpg
new_whale w_8a2e496 w_3172910 w_2c68b75 w_676ddb0,02bb5121.jpg
w_9948a99 new_whale w_9967edd w_8069cbb w_7914111,02bc3885.jpg
new_whale w_211aa88 w_8bde95b w_de3cab3 w_b67bfeb,02bd2d21.jpg
new_whale w_ddbf533 w_b8fdb8e w_1f00cb7 w_a26a029,02bea56b.jpg
w_b96c08e w_4be8a3e w_b9f5b8b w_ba2f2c4 w_6f211a9,02c66a1a.jpg
new_whale w_9291cdf w_effd0ea w_55c9a3b w_22b8a16,02d11e83.jpg
w_715d152 w_16e3c6b w_4b04829 new_whale w_2a9727c,02d1ea75.jpg
new_whale w_38e4aae w_35453e0 w_fd1cb9d w_89e159a,02d4e020.jpg
new_whale w_ed3bd5b w_f83b1f9 w_0e737d0 w_f02bf23,02e4cbe1.jpg
new_whale w_e3b236d w_db2baec w_7f81114 w_7f81114,02e6a238.jpg
new_whale w_e1431ba w_2d25d1f w_238bbbf w_238bbbf,02e79c1d.jpg
new_whale w_410fb0a w_88f693b w_3674103 w_c11fce0,02ed2a9e.jpg
new_whale w_1e31d24 w_681dba6 w_c0648b9 w_fd628f1,02ed6104.jpg
new_whale w_5fbef36 w_2196938 w_90a743c w_f95ef7c,02f022ce.jpg
new_whale w_e24a84d w_8f50a1f w_c0bb183 w_7586198,02f595b9.jpg
new_whale w_3c27f42 w_90f74ae w_945aefe w_3166a4d,02f84c93.jpg
w_b8bfaf1 new_whale new_whale w_01319fa new_whale,0300b9f2.jpg
w_4af3e4e new_whale w_3f0f6ba w_5d50ea2 w_5a81425,03026564.jpg
new_whale w_30dc5ce w_c58b474 w_c66638b w_ebe0ad5,03036b75.jpg
w_18eee6e new_whale w_7fc15e6 w_b6886e5 w_b6886e5,0308991b.jpg
w_ea90267 w_733fe81 w_88f57d0 new_whale w_d6a9529,03092073.jpg
w_ec354a5 w_51969d2 w_b6886e5 new_whale w_b34793e,030ac4a7.jpg
new_whale w_73e1d5b w_7c7a78c w_10ace22 w_0beef28,03119ded.jpg
new_whale w_c06dd6e w_414c24a w_28cd742 w_c4c8491,031ded9d.jpg
new_whale w_79b12d8 w_67de30b w_1743d93 w_1ac4c38,031ff1e8.jpg
new_whale w_c8f7bcd w_bb6afc8 w_ff7630a w_8fab53d,03235f94.jpg
new_whale w_fe49bc4 w_fe49bc4 w_e02fe7b w_e93d181,03290d42.jpg
new_whale w_9927328 w_2482b4a w_2482b4a w_1014df7,03292c72.jpg
w_22bcbd6 new_whale w_c6823b1 w_530f87b w_125ba17,033263d1.jpg
new_whale w_d234e6b w_0fa8587 w_0f96780 w_dbda0d6,033c1969.jpg
new_whale w_3d0bc7a w_d915632 w_2018f6c w_12f2352,033c7851.jpg
new_whale w_b688397 w_79b42cd w_15f29b7 w_5919cf7,033cdc6f.jpg
w_be3c0f5 w_e61dd6d new_whale w_86113c4 w_bc62c0e,033e77b1.jpg
w_9ae554b new_whale w_4a1e58b w_69185bb w_064ab78,033eee72.jpg
new_whale w_3fc3d07 w_d3861a1 w_7523d74 w_2b0028d,035333d0.jpg
w_02d5fad new_whale w_c74ab24 w_65efe4d w_c7efb86,0359f5fb.jpg
new_whale w_330f897 w_874cf52 w_fce6ab2 w_b0a5c8d,036bebee.jpg
new_whale w_fd3e88d w_2482b4a w_da0b8b5 w_8376b7e,0372c7d4.jpg
w_0ea659e w_9269ec6 w_2cadad2 w_edcb241 new_whale,03745b68.jpg
new_whale w_8db45b7 w_c7b05e7 w_acff672 w_51969d2,0374a0a2.jpg
new_whale w_38b1edd w_cdda58e w_c39fceb w_8397970,0374bf82.jpg
new_whale w_4b95330 w_8cc9b05 w_e30e97f w_e30e97f,0382090e.jpg
w_5dddfbe w_2ac069f w_9868b95 w_8fac7da w_6badfcf,03823d12.jpg
new_whale w_4e7fc3e w_ab9fa59 w_4659acf w_4659acf,0388206c.jpg
new_whale w_26bd720 w_0b7e949 w_d014794 w_91f80eb,038c5e79.jpg
new_whale w_e594616 w_4432150 w_577e627 w_577e627,03919887.jpg
new_whale w_9dc4181 w_b688397 w_964c1b3 w_642bd9e,039208f5.jpg
new_whale w_09dd18c w_09dd18c w_bde9c34 w_ab4cae2,03962130.jpg
new_whale w_701972b w_447643b w_7875b79 w_dd0c2e0,039ba9f1.jpg
new_whale w_0e737d0 w_ad87135 w_a18d0dc w_379ba08,03a02393.jpg
w_b4732ef new_whale w_fb4d1f1 w_d037229 w_d037229,03a6788d.jpg
new_whale w_ffa78a5 w_6202983 w_95b6cc3 w_b9d27c6,03acbfc4.jpg
w_02bb4cf new_whale w_a5a13d0 new_whale w_429e9ad,03acc8bc.jpg
new_whale w_badfc4b w_92c7ace w_5b2bb99 w_3a7d86d,03b17658.jpg
new_whale w_89e159a w_6a3210a w_b6689cc w_4a4546c,03b61d44.jpg
new_whale w_1c69443 w_dfd7ee8 w_5b8f282 w_331df94,03b77f05.jpg
new_whale w_5c0e858 w_de3cab3 w_ad370e1 w_01a51a6,03c3a5f5.jpg
new_whale w_853c1f7 w_43be268 w_24212f5 w_24212f5,03c6c2eb.jpg
new_whale w_0c883eb w_91f80eb w_330286e w_0013924,03c9e961.jpg
w_17370ba w_e0f1df1 w_6af9dd7 w_f21f2ec new_whale,03ca6736.jpg
new_whale w_73cbacd w_488cdd8 w_002dc11 w_73d5489,03ce181f.jpg
new_whale w_1539fee w_987a36f w_432b162 w_bcb0696,03d95ec9.jpg
new_whale w_29d2cec w_0ebd514 w_8b56cb1 w_5b08542,03df3506.jpg
w_3b0894d w_3608443 w_e62b5d8 w_075aa6e w_075aa6e,03e22730.jpg
w_636638f w_520d618 w_86b3f04 w_837646b w_19e5d10,03e2b7ab.jpg
w_2d99a0c w_e61dd6d new_whale w_92be3ca w_92be3ca,03e67864.jpg
new_whale w_3d3c0f9 w_d75aff6 w_1b67a2e w_c80d300,03ec3ef3.jpg
w_905d41b w_79b12d8 w_f81c626 w_aef3680 w_8b6fd36,03ecfbe1.jpg
w_5d50ea2 new_whale w_3f0f6ba w_29eb3b2 new_whale,03ed35cc.jpg
w_018bc64 w_b942708 new_whale w_71764b4 w_fe2742d,03ef82dd.jpg
new_whale w_66c1b54 w_a93c8f9 w_d7de1ee w_ace8c54,03f28af0.jpg
new_whale w_ceffa10 w_f0a2e40 w_9f718e8 w_392bee3,03f5b5c7.jpg
new_whale w_11adaae w_d0e5d1d w_9a8684f w_7c943ab,03f88c16.jpg
w_0103030 w_bf31e4a new_whale w_c45bfc3 w_aff0877,03f9d82a.jpg
w_0a565c5 new_whale w_c90c37a w_980bb1a w_bbc2a14,03fa1cb6.jpg
new_whale w_0dc176f w_2a04ceb w_2a04ceb w_c5d7c03,04029c8d.jpg
new_whale w_1272a31 w_0cd401c w_8244367 w_7e1521a,040684d5.jpg
w_0ebd514 w_ec02248 w_865c2ba w_ca40961 w_0f84bf6,0409a4de.jpg
new_whale w_f792125 w_77fbe5c w_4225bb3 w_d19a884,040afaab.jpg
w_2cb8996 w_f2b8caf new_whale w_5aa4856 w_cd22b23,040c2a16.jpg
w_6361632 w_108670b w_8cd3036 w_3f365f3 w_3b0894d,04170baa.jpg
w_b9e00eb new_whale w_cb3bd52 w_b8fdb8e new_whale,041bf60e.jpg
w_ccfdb00 new_whale w_ca13d58 w_8d83172 w_fed0031,04342c48.jpg
w_43e45b6 w_0626e4d w_fe5e78b w_fe5e78b new_whale,0439dff2.jpg
new_whale w_e45bc18 w_89e451c w_987a36f w_540fd73,04413971.jpg
w_fd07344 new_whale w_338d945 w_17d5eb9 w_17d5eb9,0442910d.jpg
new_whale w_93f1362 w_6918155 w_9287bbb w_39043c9,0445463a.jpg
new_whale w_e58fbe3 w_9ec358c w_b05f565 w_f660d7d,0447f9d8.jpg
w_5fbef36 new_whale w_93a4f60 w_2196938 w_e33bb21,04494ac2.jpg
new_whale w_992c775 w_12cdfbd w_12cdfbd w_2fe43c7,0451e3e7.jpg
w_5824675 w_3eaef21 w_0e0e856 w_0d733a5 new_whale,045638e1.jpg
w_69e1d0a w_7394d75 w_ab2d17a w_8a2793e w_06b6f60,0456f788.jpg
new_whale w_9c4bb3c w_0e737d0 w_0e737d0 w_1924883,045747b5.jpg
w_72e70e5 w_045d9fc w_759b647 w_ea4935f new_whale,045a1f17.jpg
new_whale w_4fdaa2a w_1dc66b7 w_3e1ccc9 w_b8dff40,045b23f2.jpg
new_whale w_78f2e92 w_07274b2 w_e0efc4f w_f86488a,045d0da3.jpg
new_whale w_ab6db0f w_12f2352 w_f792125 w_c0d494d,045d7a31.jpg
w_fd1cb9d w_50d2084 new_whale w_3fffc61 w_c0560ac,0466a76a.jpg
new_whale w_c27d036 w_dce3192 w_dfec7a3 w_8b56cb1,0469d626.jpg
new_whale w_e0efc4f w_b067417 w_059df09 w_4f6c7e0,046ebec1.jpg
new_whale w_8643ba3 w_e2e56e9 w_01c2cb0 w_01c2cb0,04735120.jpg
new_whale w_7f81ba5 w_3c3c632 w_2730966 w_f369a80,04782092.jpg
w_d19a884 w_69e7dab new_whale w_0c6dbbe w_0c6dbbe,047a1f36.jpg
w_4176a19 w_3c3c632 new_whale w_7b770ec w_39043c9,047f991c.jpg
w_dce3192 new_whale w_865c2ba w_865c2ba w_17ee910,0480833f.jpg
new_whale w_59eb8ae w_905d41b w_dfd7ee8 w_8d83172,048512e2.jpg
new_whale w_a2564cf w_43be268 w_242a05d w_7c7a78c,04873154.jpg
new_whale w_7dc3fae w_96b8436 w_e2241ce w_a526492,0488fd16.jpg
w_9122179 w_2901987 new_whale w_a8458c8 w_e0f1df1,048c312f.jpg
w_bbf58a9 w_bbf58a9 w_93bf889 w_103488f new_whale,048e1daa.jpg
w_1287fbc w_1287fbc w_09d7946 new_whale w_1287fbc,048ee592.jpg
w_98507b5 new_whale w_cb9220b w_7db10cc w_9ae554b,048f3453.jpg
w_d22af00 w_fb2b2c2 w_0e7cb1c w_9496577 w_15d7ecf,04954b79.jpg
new_whale w_b820615 w_3d0bc7a w_d915632 w_1274a11,04977677.jpg
new_whale w_6863829 w_f86488a w_f3bd33a w_f3bd33a,0497a42a.jpg
w_414f402 w_1ae1386 w_f031837 w_cd70e8b w_e3b236d,04997d5e.jpg
new_whale w_77e3e0f w_b9f5b8b w_4b47559 w_7d896ac,049b46d5.jpg
w_4e8f84d w_8158b1f new_whale w_26f9f95 w_7377b2b,049c3da3.jpg
new_whale w_43be268 w_43be268 w_89973e5 w_64f3545,049dd98d.jpg
new_whale w_4855bd3 w_59eb8ae w_b8dff40 w_b6886e5,04a02f6a.jpg
new_whale w_ab161f7 w_993dbe8 w_c583383 w_7c6ad05,04a5b7d8.jpg
new_whale w_9c70a11 w_9605bf1 w_987a36f w_7759db0,04a84b41.jpg
new_whale w_694c109 w_a7f847f w_c3ff6f2 w_b3e6069,04a9359b.jpg
new_whale w_654a5bb w_44beff0 w_551f5ca w_cb7b682,04ac112f.jpg
new_whale w_f86488a w_f86488a w_dd66cf9 w_fd1cb9d,04aef21e.jpg
new_whale w_12cdfbd w_12cdfbd w_f5b8faf w_1b1c4f1,04aef436.jpg
w_33973bf new_whale w_7b035cc w_d0b3293 w_4e1f7bd,04b0f138.jpg
new_whale w_3f5e7fc w_ebf3f26 w_4e8f84d w_1ec267f,04b9dbff.jpg
new_whale w_f4fc8cc w_6f2c662 w_b6886e5 w_b6886e5,04bb7f32.jpg
w_6598219 w_e38b2c7 new_whale w_c01beb7 w_cc759cd,04d1b1e2.jpg
new_whale w_7c943ab w_7554f44 w_eea20c4 w_6926f08,04d62bd2.jpg
new_whale w_edcb241 w_effd0ea w_ee23a5f w_0ea659e,04da9182.jpg
w_abe383e new_whale w_242a05d w_242a05d w_e0f1df1,04daa8f0.jpg
new_whale w_22f0a7d w_1ec267f w_694c109 w_08f1502,04def9fe.jpg
w_7852bd1 w_2f54c3c w_05396d8 new_whale w_3f43888,04e42b2c.jpg
new_whale w_6710cf8 w_4b04829 w_9438980 w_7ab1759,04e8fe6b.jpg
new_whale w_1addcc2 w_30d8376 w_0f89e72 w_36d665c,04e905f8.jpg
w_1652da1 w_f792125 new_whale w_ff5538f w_e8a8d85,04eaef5b.jpg
new_whale w_1c432e7 w_9146eae w_f03ca16 w_f03ca16,04eeb6f7.jpg
w_89e159a w_b9c9129 new_whale w_abe383e w_19f7a8b,04f46b7d.jpg
w_2dc2ef2 new_whale new_whale w_5b5a85d w_515838e,04f6c3e3.jpg
w_2e872af new_whale w_db0ad01 w_e3c0ae5 w_5bc5e63,04fdbb18.jpg
new_whale w_4f217e3 w_d10c9ff w_773967d w_5a81425,04ffb75b.jpg
w_cd1f1ed w_d4eb9ed w_ace8c54 w_b4732ef w_601b6d4,05056a76.jpg
new_whale w_cc22f68 w_80bae3a w_70e49bc w_54fc5b3,050cfb88.jpg
new_whale w_bf4880a w_bf4880a w_e93d181 w_218b25e,050fd4cd.jpg
new_whale w_d663f4f w_bc62c0e w_9e1e818 w_ba8c7bc,05143e63.jpg
new_whale w_35c8057 w_a965f14 w_a965f14 w_62ca7c8,051aa421.jpg
new_whale w_e3c119c w_5af463d w_1287fbc w_c0d494d,05205364.jpg
new_whale w_127f4c6 w_11adaae w_6c899ff w_f2d87b0,05268c81.jpg
new_whale w_38e4aae w_e0f1df1 w_c751211 w_1fd0d0e,052b04fa.jpg
w_fba3bde w_44cccf6 new_whale w_7e5cc5e w_7e5cc5e,052c1353.jpg
new_whale w_e826a6f w_0cb6294 w_3ae3603 w_dbda0d6,052fc20e.jpg
new_whale w_02bb4cf w_02bb4cf w_61e1076 w_00b621b,0538b4cf.jpg
w_34fd328 new_whale w_77e1ae3 w_33e89be w_3dc5e74,053bfc7e.jpg
w_771d855 w_d2be6cc w_ddf14ae w_6c803bf w_17a2610,0540d585.jpg
w_3d8c865 w_0f16be3 w_52eecb4 w_699be3a new_whale,05447383.jpg
w_9434f0c w_bbc2a14 w_bbc2a14 new_whale w_0a0cf7d,054a6881.jpg
new_whale w_3197568 w_9ca943b w_ee17a08 w_a494171,054f8aeb.jpg
w_a74742c w_00fbb4e w_df21074 new_whale w_ce7c6c0,054f9ad2.jpg
w_05396d8 w_def505e w_6e8486d new_whale w_59eb8ae,05588003.jpg
new_whale w_92b35ca w_0f96780 w_0f96780 w_fe49bc4,055e2312.jpg
new_whale w_33b9360 w_33b9360 w_639aed5 w_2e977e2,05602dd9.jpg
new_whale w_e594616 w_717a293 w_8cd3036 w_286ec5f,0563f85b.jpg
w_d4bc10d new_whale w_5cb5fc3 w_376a413 w_5ba417d,0566148a.jpg
new_whale w_4c9d3df w_4e52a49 w_fc7cc24 w_eb47189,0567973e.jpg
w_6affb63 w_73321ab new_whale w_c27d036 w_9ec358c,056a44f5.jpg
new_whale w_4403803 w_cd788c3 w_64f3545 w_c8d20aa,056dbcc1.jpg
w_4f103de w_3b90f9b w_83034c7 new_whale w_3ee8570,057bf614.jpg
new_whale w_7459706 w_7459706 w_7311fe4 w_8c1ec28,057e01c4.jpg
w_a533837 w_e7aa703 w_3023ee5 new_whale w_1652da1,057ecaff.jpg
w_b282692 w_a25caa9 w_72dfe51 new_whale w_5919cf7,057fe50e.jpg
new_whale w_711aaa1 w_67de30b w_d1bbde9 w_7ab1759,058491ed.jpg
new_whale w_e0e5c9e w_7419e4b w_7419e4b w_11f6df1,058fc362.jpg
new_whale w_1a229eb w_1a229eb w_f0a2e40 w_bbc2a14,05902160.jpg
w_654a5bb new_whale w_69e7dab w_ed3bd5b w_d9aab0a,059c0d79.jpg
w_b721e96 w_b721e96 w_5374a4c w_e5250e9 new_whale,059dff9f.jpg
new_whale w_17d5eb9 w_17d5eb9 w_076c122 w_5eda687,05a96a11.jpg
w_70a31ce w_c58b474 w_ab9fa59 new_whale w_8c9ed42,05af4415.jpg
new_whale w_fa32440 w_313b78a w_b6689cc w_1287fbc,05b1013c.jpg
new_whale w_0e4ef50 w_79071e8 w_d76d3bb w_ab4cae2,05b2063a.jpg
new_whale w_0f84bf6 w_50d2084 w_69e998f w_272259b,05b21b0e.jpg
w_26edeb8 new_whale w_aae82f8 w_dbd28fa w_c30959a,05b23512.jpg
new_whale w_a25caa9 w_b9e00eb w_b329c00 w_19aeb9c,05b33bcf.jpg
new_whale w_e115a81 w_3b99025 w_d7b85ec w_1272a31,05be1b3b.jpg
new_whale w_aed023d w_fba3bde w_0134192 w_0e9f6d9,05c0ee5c.jpg
new_whale w_0a565c5 w_d1917df w_0ea2545 w_5a81425,05c3bb81.jpg
new_whale w_2832e90 w_d88328d w_12cdfbd w_12cdfbd,05c524b5.jpg
new_whale w_67de30b w_4e52a49 w_61b87f9 w_f18df18,05c5d85b.jpg
new_whale w_6f31916 w_dba0cd8 w_823fcbb w_7914111,05c9f7a4.jpg
new_whale w_dc97dc3 w_af9a47a w_a0c378c w_a4d41b4,05d0b6ae.jpg
w_6badfcf new_whale w_64433af w_c3f9618 w_35063ed,05d0f35c.jpg
new_whale w_dcf1fd1 w_d40f276 w_57c8da9 w_ccfdb00,05d5c3a7.jpg
new_whale w_fe49bc4 w_7554f44 w_0f96780 w_6547e12,05d87d8b.jpg
w_2216a46 w_b9e00eb new_whale w_5deefd9 w_b9e00eb,05dc49c5.jpg
w_9e862ac new_whale w_46e45e6 w_1f10750 w_520d618,05df666d.jpg
new_whale w_125ba17 w_38e088a w_f2b0e93 w_dbda0d6,05e1c530.jpg
w_c0560ac new_whale w_50d2084 w_8a5ff14 w_f5b8faf,05ec970c.jpg
new_whale w_9146eae w_9146eae w_01f211f w_01f211f,05ece22a.jpg
new_whale w_dbda0d6 w_83a922d w_43e45b6 w_1161030,05f17a1f.jpg
new_whale w_8fec0dd w_c66638b w_30dc5ce w_d2b4956,05f58ec7.jpg
new_whale w_8c408dc w_591db29 w_ab4bd59 w_75378d3,05f6a1c4.jpg
new_whale w_c0bb183 w_153645e w_cdc21df w_8f50a1f,060d7d39.jpg
new_whale w_9438980 w_cb7d1b5 w_bc18612 w_2863d51,060f7c21.jpg
new_whale w_6ae1eaf w_94e1ed4 new_whale w_8103039,0611787a.jpg
new_whale w_4439f3d w_4432150 w_ee17a08 w_15b9665,0615a20f.jpg
new_whale w_b440303 w_e08089e w_16d1b32 w_16d1b32,0619b2a2.jpg
w_ca5f17f new_whale w_5acfa65 w_175536a w_f3db3f1,0622333a.jpg
new_whale w_9b401eb w_1287fbc w_1287fbc w_27b9e86,062f56fa.jpg
w_50729c4 new_whale w_79071e8 w_88b5d47 w_23cd105,0632abdd.jpg
new_whale w_f8d2cd9 w_bbe06a7 w_49f3a91 w_5f6fb4e,063a8ecd.jpg
w_064ab78 w_77166cc new_whale w_2f81b85 w_4659acf,063b8988.jpg
new_whale w_d75aff6 w_5a81425 w_5a81425 new_whale,064035ba.jpg
new_whale w_b074cdf w_e3c0ae5 w_e9f85b7 w_7311fe4,06411151.jpg
new_whale w_f792125 w_b3e6069 w_0f20cbc w_73d5489,06470cc5.jpg
w_1e5a146 w_44f66a7 w_44f66a7 w_7233641 new_whale,0647afb6.jpg
new_whale w_f81c626 w_18a854b w_8c1ec28 w_ef7755e,0648cad6.jpg
w_5f50b5e w_9411f86 w_518129a w_1ec0481 new_whale,0649db91.jpg
new_whale w_f660d7d w_a4f77bd w_65943d6 w_4659acf,064e4e3e.jpg
new_whale w_b678944 w_53e9072 w_8575984 w_e57b3ce,0658195c.jpg
new_whale w_ba5336c w_7554f44 w_7554f44 w_7554f44,0659057f.jpg
new_whale w_d10472d w_2fd21ec w_5d06bc3 w_a048f26,065d4e20.jpg
w_3d66298 w_c0cfd5b w_b7d5069 w_a7d4668 w_5b576a0,065da4f9.jpg
new_whale w_217e78a w_d398969 w_43966a3 w_2282bb8,0664c407.jpg
new_whale w_d47e2e3 w_ca6a771 w_afbc150 w_491607b,0670ae75.jpg
w_5e0e662 w_6b3402d w_f70f725 w_33b9360 w_1539fee,0674ed18.jpg
new_whale w_6c899ff w_dd66cf9 w_63131a3 w_0beef28,06761cbc.jpg
w_68820e8 new_whale w_048f7a9 w_048f7a9 w_1dff010,06764db3.jpg
new_whale w_53064a6 w_ec91e99 w_434ad6a w_c27d036,0679ea22.jpg
w_8b56cb1 w_79185c2 w_814a588 w_4fcfa4d w_4fcfa4d,067c3565.jpg
new_whale w_6918155 w_e4f1fcc w_6734e40 w_cda4b05,068386dc.jpg
new_whale w_64f3545 w_dce3192 w_01b2250 w_aae82f8,06864eee.jpg
new_whale w_fb99d39 w_1638016 w_a254eb0 w_1638016,0686fe51.jpg
new_whale w_6e26345 w_19e8a2d w_b8cba61 new_whale,068d9d17.jpg
new_whale w_23e5a4c w_0a565c5 w_3f0f6ba w_09f825c,0690a752.jpg
w_f0d8be1 new_whale w_cb7b682 w_7248590 w_eb0a6ed,06923a5a.jpg
new_whale w_d2f081f w_eb47189 w_eb47189 w_a14ccaa,06a74b57.jpg
w_a38d1a3 w_0beef28 w_73b26b7 new_whale w_d4b90bf,06a83512.jpg
new_whale w_5cb5fc3 w_e41fd4f w_7632107 w_8b15b96,06ac26de.jpg
w_b081817 w_5b99089 w_5b99089 new_whale w_c0d494d,06b0cf32.jpg
new_whale w_741861e w_076c122 new_whale w_6a3210a,06b3a019.jpg
w_0d733a5 w_4ce0510 w_ab39440 new_whale w_0d733a5,06b44689.jpg
w_f3db3f1 new_whale w_d78513b new_whale w_293b5e4,06bb2e51.jpg
w_63d1ea6 new_whale w_3136deb w_1beadba w_ecb9a79,06bcc8dd.jpg
w_8397970 new_whale w_1606afc w_f7d5919 w_ace5d0c,06bcf1df.jpg
w_b9e00eb new_whale w_ac87f37 w_95aad92 w_e30e97f,06c4a3a5.jpg
new_whale w_8b56cb1 w_6710cf8 w_53064a6 w_a59905f,06c51e89.jpg
new_whale w_c053b99 w_56743d6 w_39043c9 w_eb0a6ed,06c7cc20.jpg
new_whale w_b5383b5 w_2bba8c8 w_4f6fabd w_511c464,06ca2e42.jpg
new_whale w_1eafe46 w_e02fe7b w_fd07344 w_05b2ddd,06ccb0c8.jpg
w_49bbc79 new_whale w_717a293 w_5abb7d5 w_5abb7d5,06cf2e43.jpg
new_whale w_2071a4c w_5b45503 w_735ce7d w_1d2fbc1,06d0a7cd.jpg
new_whale w_505a141 w_0e9f6d9 w_dfec7a3 w_7e5cc5e,06d274be.jpg
w_e613f12 w_4ce0510 w_4b16688 w_989fbbb w_25ec80a,06d50c66.jpg
w_ca4ca6f w_efe57c7 w_f6e5eca w_1596a47 w_96fd936,06d60841.jpg
new_whale w_9dfbd27 w_31a93e7 w_8a3449f w_7649712,06e38173.jpg
w_90ec71a new_whale w_a335e80 w_2fd21ec w_5b8f282,06e4483c.jpg
new_whale w_cf00b01 w_d89b29e w_fe2742d w_f2e9eb1,06e6f685.jpg
new_whale w_e594616 w_4432150 w_577e627 w_577e627,06e7567d.jpg
new_whale w_e54feba w_0b0d88d w_dfec7a3 w_67de30b,06f099aa.jpg
new_whale w_ddf0c2c w_697c72e w_2b930da w_8e25bfa,06fad355.jpg
w_1b332ba new_whale w_4c9d3df w_dac2f44 w_2a939eb,06fc99b2.jpg
new_whale w_1287fbc w_fd1cb9d w_73d5489 w_86ff8a6,0700d66e.jpg
w_ace8c54 new_whale w_e02fe7b w_cd1f1ed w_25fdcfb,0703bb75.jpg
w_aca9607 w_dcb1f2a w_fc7cc24 w_d663f4f new_whale,070837c1.jpg
new_whale w_57c14db w_4b95330 w_c3ff6f2 w_0a565c5,070939d4.jpg
w_ab6db0f new_whale w_8d83172 w_f803b29 w_b29214f,070a0cfd.jpg
w_6a87d0d new_whale new_whale w_e6ec8ee w_303518a,07138d90.jpg
w_656afeb w_43be268 w_c133ea8 new_whale w_656afeb,0713b8d1.jpg
new_whale w_52c1af6 w_c1c73c0 w_e655c65 w_47906dc,07175ead.jpg
new_whale w_034a3fd w_71f6bc5 w_fe8233d w_279b255,071c5ab6.jpg
new_whale w_2bdd2df w_6c803bf w_656afeb w_ea2385d,07202b51.jpg
w_ab6db0f w_abc2eda w_19dc50f w_19dc50f w_d9fdd15,0722ea4e.jpg
w_9dfbd27 w_7294a6a w_a7202e1 new_whale w_a56d9ff,0723673f.jpg
new_whale w_ebf3f26 w_d937660 w_41a260a w_e6ddbd5,072a9420.jpg
w_ca813c2 w_8bde95b w_a24f581 w_540fd73 w_da1cc7a,0734daee.jpg
new_whale w_5bb7ae9 w_449e238 w_626ef9f w_0fc4835,073da2c4.jpg
new_whale w_24a2923 w_9d2ded8 w_37223f9 w_12c3d3d,0743e630.jpg
w_6b3402d new_whale w_5e0e662 w_33b9360 w_1539fee,07441b1a.jpg
new_whale w_a25d46c w_8fac7da w_6badfcf w_41c0098,07486078.jpg
w_2863d51 new_whale w_54c00ad w_0378699 w_4e52a49,074acd73.jpg
new_whale w_5a81425 w_8cc9b05 w_0ea2545 w_c90c37a,074bb896.jpg
new_whale w_bb2d34d w_d2be6cc w_451f507 w_451f507,074be802.jpg
new_whale w_143b201 w_7f199c6 w_143b201 w_6ab7b53,07590976.jpg
