Id,Image
w_b47a4a1 w_f2eb971 w_2d99a0c w_661dacb new_whale,79d8d3b1.jpg
new_whale w_a24f581 w_f81c626 w_6092d5c w_bc62c0e,79deb0ac.jpg
w_78948b5 new_whale w_9d0e84a w_272259b w_414f402,79e208df.jpg
new_whale w_5557280 w_15db29f w_ee22376 w_540fd73,79e740c4.jpg
new_whale w_2730966 w_f6411ea w_4f248f3 w_7158e92,79e7a703.jpg
new_whale w_4403803 w_c99f5ef w_dbd28fa w_8c961a3,79e9b730.jpg
new_whale w_402784d w_eb0a6ed w_1f0da94 w_17411dd,79eab4a2.jpg
w_7f199c6 w_da0372d w_2bdd2df w_e24a84d new_whale,79eb3e4e.jpg
new_whale w_87e8446 w_515838e w_f6fb689 w_f6fb689,79f1d646.jpg
new_whale w_8e3ebeb w_03a2ed7 w_0de84f0 w_22bb9b3,79f67d86.jpg
new_whale w_ab4cae2 w_4b7b80b w_faf538a w_c55c9cd,79ffc07c.jpg
w_b729b1f w_338d945 w_fd07344 w_bb2d34d new_whale,7a028436.jpg
new_whale w_2658649 w_e4f1fcc w_bdfd16e w_7b770ec,7a08794b.jpg
w_73b26b7 w_87e00c8 w_f031837 w_19f0b15 new_whale,7a08c09e.jpg
new_whale w_b478c13 w_ab6db0f w_b729b1f w_e54feba,7a0b7f6b.jpg
w_d2be6cc new_whale w_18eee6e w_a22f338 new_whale,7a0d3770.jpg
w_6a78025 new_whale w_831f124 w_5ea3410 w_2d57dce,7a112801.jpg
w_dfd7ee8 new_whale w_577e627 w_577e627 w_b942708,7a11f5b1.jpg
w_e3f51ec w_e3f51ec new_whale w_15427c3 w_8044362,7a126d57.jpg
w_0e7cb1c w_1ddb63f w_ba53619 new_whale w_305ed07,7a129b43.jpg
new_whale w_8c605d2 w_0de84f0 w_79071e8 w_41ed8e8,7a15ab31.jpg
new_whale w_7419e4b w_2901987 w_6e47e0e w_a31aa30,7a16455b.jpg
w_67de30b w_ead305f w_0ee4d6d w_0ee4d6d w_d6856ab,7a16a20d.jpg
new_whale w_0cd401c w_1272a31 w_b2f1afa w_6d2fe6f,7a1795e7.jpg
new_whale w_0e4f53c w_0e4f53c w_1dd8e68 w_85755f7,7a1ba673.jpg
new_whale w_0ebd514 w_d3ef4b2 w_0378699 w_9771603,7a1f9bbe.jpg
new_whale w_8148b95 w_4504167 w_4be373e w_4be373e,7a23cf20.jpg
new_whale w_2863d51 w_9ea2cc3 w_43be268 w_434ad6a,7a24239e.jpg
w_aeca19c new_whale w_c1b685f w_48a5b86 w_48a5b86,7a270116.jpg
w_9ca943b new_whale w_c30959a w_c30959a w_9ca943b,7a2b8779.jpg
new_whale w_cf00b01 w_73b26b7 w_4408e45 w_78948b5,7a2e3841.jpg
new_whale w_8861f65 w_b7a3e0a w_b440303 w_96b697f,7a312440.jpg
new_whale w_398aa7f w_1310342 w_53ed912 w_9a8684f,7a329bee.jpg
w_c352046 new_whale w_1a70685 w_0ffc383 w_d2be6cc,7a36f7a4.jpg
w_8d83172 w_7f81114 w_3b3b9b2 new_whale w_7abaf06,7a370e46.jpg
new_whale w_715d152 w_0beef28 w_93b64e9 w_93b64e9,7a371004.jpg
new_whale w_d47e2e3 w_3d66298 w_3d66298 w_8533569,7a3a59d4.jpg
w_e4d3ec3 w_b96c08e new_whale w_e10dff3 w_010a1fa,7a502f7f.jpg
new_whale w_c87c10b w_2d2d7fe w_01b2250 w_b4ad62f,7a5be11c.jpg
new_whale w_61d516e w_61d516e w_6d274b2 w_d63bf1f,7a633209.jpg
new_whale w_9b67e87 w_3d0bc7a w_3d0bc7a w_9b67e87,7a6bc29f.jpg
w_d4bc10d new_whale w_c9dc73e new_whale w_96b8436,7a71147e.jpg
new_whale w_6c803bf w_e8a9fb8 w_a67a1bc w_01c2cb0,7a715a08.jpg
new_whale w_cf00b01 w_cf00b01 w_cf00b01 w_5abb7d5,7a7206ce.jpg
w_ee17a08 w_c30959a w_e6d0696 w_59866ca new_whale,7a723b4d.jpg
new_whale w_680e011 w_94c6edb w_626ef9f w_97493dd,7a7d8ce0.jpg
new_whale w_3349c9d w_3349c9d w_7759db0 w_4e52a49,7a81cd5d.jpg
new_whale w_587d2e3 w_587d2e3 w_8cd3036 w_e594616,7a82f197.jpg
new_whale w_44a6b62 w_7554f44 w_ff7630a w_66c1b54,7a847c8d.jpg
new_whale w_95874a5 w_bb2c317 w_c95a0ea w_c30959a,7a88ca89.jpg
new_whale w_f0af1f8 w_7875b79 w_17411dd w_7e4d894,7a8de645.jpg
new_whale w_491607b w_0819271 w_7b1686d w_217e78a,7a8fde68.jpg
new_whale w_17964ef w_a0ae961 w_a0ae961 w_1dff010,7a9880a7.jpg
w_af9a47a new_whale w_f3db3f1 w_a58f64d w_964ce09,7a99dc0b.jpg
new_whale w_979dc10 w_9cb529f w_3039e7a w_33e89be,7a9c7e6c.jpg
new_whale w_0c8967d w_eb0a6ed w_ba56291 w_898eb3b,7a9e954e.jpg
new_whale w_b4732ef w_0869575 w_bc9dc37 w_bf8c3d2,7aa0f7f3.jpg
w_5f50b5e w_5f50b5e new_whale w_ab4cae2 w_3355365,7aa1d41d.jpg
new_whale w_d89b29e w_cd1f1ed w_5a6bf1f w_63db6f9,7aa70b12.jpg
new_whale w_987a36f w_987a36f w_69df882 w_69df882,7ab295e8.jpg
new_whale w_4b1fad6 w_dbf4e7f w_beb62cc w_beb62cc,7ab2a795.jpg
w_b688397 w_9c5ed68 w_a62f211 w_d2b4956 new_whale,7ab501cc.jpg
w_9ff699b w_9ff699b new_whale w_636638f w_fd218ba,7ab54eb4.jpg
w_2bea4c4 w_c94f464 w_c6be61e w_6e47e0e new_whale,7aba6bd5.jpg
w_3061bdd w_8103039 w_8103039 w_1ac4c38 new_whale,7ad0a8e6.jpg
w_af67683 new_whale w_b6886e5 w_b6886e5 w_6c803bf,7ad128f5.jpg
new_whale w_d6f3d24 w_8601045 w_fd1cb9d w_b5383b5,7ad9c0bb.jpg
new_whale w_1fb42f1 w_42dd100 w_ace8c54 w_bd61ca9,7adc8282.jpg
new_whale w_10bea88 w_0103030 w_7b442c4 w_c45bfc3,7ade6a53.jpg
new_whale w_cd01afb w_ed6da70 w_a8ec52f w_d2e1f2a,7ae531c5.jpg
new_whale w_91b7c58 w_5f6fb4e w_31d3999 w_cb6a206,7ae593ed.jpg
new_whale w_f7bf28d w_6e5b022 w_cf25b86 w_8936f42,7ae65f18.jpg
new_whale w_962164f w_07e92ee w_07e92ee w_a8ec52f,7ae89a24.jpg
w_3bc8a47 w_3bc8a47 new_whale w_f1177c9 new_whale,7ae9945e.jpg
new_whale w_d6a6360 w_7de72c5 w_f60c7e8 w_f60c7e8,7af2d6dc.jpg
new_whale w_987a36f w_662a132 w_b34793e w_b34793e,7afd474f.jpg
new_whale w_8397970 w_8397970 w_330286e w_279b255,7afe2699.jpg
w_92d390e w_0e737d0 new_whale w_cdc21df w_3063bf4,7b02cddb.jpg
w_db2baec w_56bbc91 new_whale w_33973bf w_33973bf,7b03445a.jpg
new_whale w_b39c722 w_78f2e92 w_0853262 w_5ee752a,7b078d00.jpg
new_whale w_447643b w_7875b79 w_5b1fa1d w_697c72e,7b08f0fc.jpg
new_whale w_817f022 w_fd1cb9d w_849b126 w_76387b4,7b1414c7.jpg
w_2d99a0c w_aed6a9a new_whale w_e964ae8 w_e964ae8,7b1b6e1f.jpg
new_whale w_d141590 w_4fb3c95 w_c90feaa w_efebfe8,7b1bc937.jpg
new_whale w_53064a6 w_ec91e99 w_434ad6a w_c27d036,7b1cce35.jpg
new_whale w_f8d2cd9 w_a358522 w_507e610 w_8a00b09,7b1e0fe4.jpg
w_18eee6e w_3de676c new_whale w_1a70685 new_whale,7b20e51b.jpg
w_8f3cb68 new_whale w_cb7b682 w_7dee51b w_53dbf9d,7b230f77.jpg
new_whale w_ec67c71 w_2dea395 w_76048fe w_4b950da,7b23719e.jpg
new_whale w_2eabd5a w_d3c8520 w_ac8329d w_989fbbb,7b26f5d2.jpg
new_whale w_68a3df0 w_d708c5a w_a533837 w_9948a99,7b2f54d2.jpg
new_whale w_f0b4252 w_0626e4d w_3650949 w_6badfcf,7b3bac3d.jpg
new_whale w_00cb685 w_56ddb00 w_d3861a1 w_08f1502,7b44f7ce.jpg
new_whale w_cf092f5 w_e38b2c7 w_e38b2c7 w_dff77b6,7b483ebd.jpg
w_9771603 w_9771603 w_eb47189 w_2a939eb w_0771d4b,7b48f6b3.jpg
w_4cedbf8 w_c663985 new_whale w_680e011 w_7923fdc,7b5261da.jpg
w_7763134 new_whale w_ea9b531 w_98baff9 w_fbb485b,7b58ce33.jpg
w_d2324e2 w_f43935f w_c87b956 w_a2a1378 new_whale,7b5a0c26.jpg
new_whale w_d3c8520 w_ef99fe9 w_91faa95 w_d3c8520,7b5ec3c5.jpg
w_1dff010 w_1a5e7a2 w_f4fc8cc w_b05c57f new_whale,7b6af631.jpg
new_whale w_ee9c4d7 w_4c8244d w_26edeb8 w_71764b4,7b708961.jpg
new_whale w_5ae47d9 w_29f00ae w_af6c7e2 w_15c39f4,7b7414a4.jpg
new_whale w_4e0eaa1 w_cae7677 w_86ff8a6 w_a254eb0,7b7a3760.jpg
new_whale w_4408e45 w_d6a3892 w_4f38350 w_78948b5,7b89744c.jpg
new_whale w_f19faeb w_0f41afe w_b318111 w_b4d182b,7b8bf000.jpg
w_5e57e8b w_71e851f new_whale w_735675e w_b7a832a,7b8f3b94.jpg
new_whale w_2bb8c37 w_02e5407 w_7f867ec w_1c6d5f0,7b8f9146.jpg
new_whale w_05ecba5 w_0ebd514 w_934736d w_da64f8d,7b952388.jpg
new_whale w_94cd45e w_67fecca w_00d8453 w_e7f03cf,7ba70ac6.jpg
w_02d7dc8 w_d78513b new_whale w_d20befa w_f3db3f1,7baa93ae.jpg
new_whale w_9741f42 w_9741f42 w_656afeb w_656afeb,7baf63df.jpg
new_whale w_a38d1a3 w_df15cc8 w_999275d w_7cc620b,7baf78c3.jpg
new_whale w_d382236 w_42cc88d w_89e159a w_07a425f,7bb1c795.jpg
new_whale w_d2be6cc w_b970272 w_18eee6e w_6c803bf,7bb9e942.jpg
w_cdc0a1c new_whale new_whale w_143b201 w_e449d3a,7bbc9d88.jpg
new_whale w_d3c8520 w_0a0cf7d w_7f81ba5 w_f460394,7bbec8af.jpg
new_whale w_528e753 w_3674103 w_0103030 w_5f82501,7bc053c8.jpg
w_c663985 new_whale w_e62680c w_288e40b w_55b1d69,7bc87ff1.jpg
new_whale w_27cf4e2 new_whale w_010a1fa w_0bc712b,7bcb6df6.jpg
new_whale w_cd65880 w_29eb3b2 w_515838e w_1cd9331,7bcc6bf6.jpg
new_whale w_6af9dd7 w_b7d5069 w_ad32646 w_bbf20b4,7bccefb7.jpg
new_whale w_56b9dcd w_89154d2 w_38ef4a3 w_3172910,7bcf5f6e.jpg
w_7419e4b w_718ce15 w_4e52a49 w_2901987 new_whale,7bd3181d.jpg
w_681dba6 new_whale w_e4c8d6d w_b7fe199 w_b9f5b8b,7bd3e752.jpg
w_d89b29e new_whale w_9a94e29 w_44f0fa2 w_1310342,7bd748c7.jpg
new_whale w_da6d50b w_b7d5069 w_6375873 w_fe49bc4,7bd8b3e8.jpg
new_whale w_6e5b022 w_9874f0d w_01f211f w_01f211f,7be03bb5.jpg
new_whale w_6a78025 w_8397970 w_8397970 w_8533569,7be3155a.jpg
new_whale w_2482b4a w_fd3e88d w_ede13b5 w_0827d51,7be33de1.jpg
new_whale w_3fcb80e w_4f6c7e0 w_bf38f05 w_bf3449f,7be5b81d.jpg
new_whale w_78b325d w_52b06b1 w_bf8c3d2 w_b7d5069,7bf20793.jpg
w_6e20206 w_f79b3f9 w_21b3754 w_e147c40 new_whale,7bf36f43.jpg
new_whale w_86b9dfd w_ab4bd59 w_c4cafb8 w_e09d8cf,7bf4a206.jpg
w_d20befa new_whale w_c6f1bff w_9091ae6 w_5b1fa1d,7bf796f1.jpg
w_0471bdf w_5817e08 w_cc54cee w_ab4cae2 w_41f0a7e,7bf7e077.jpg
new_whale w_37c23fa w_587d2e3 w_ff70408 w_cf00b01,7bfd83bf.jpg
new_whale w_5cef366 w_8968506 w_b0e05b1 w_0b3b659,7bffcbf1.jpg
new_whale w_7c7a78c w_71764b4 w_a14ccaa w_a14ccaa,7c057791.jpg
w_f5b8faf w_aae82f8 new_whale w_4b33077 w_2f1e886,7c05adc5.jpg
new_whale w_397e3db w_cddb3f4 w_fd9264d w_c3ff6f2,7c0981a1.jpg
new_whale new_whale w_175536a w_20c671c w_ca5f17f,7c1226a5.jpg
new_whale w_e156c87 w_d4c25b6 w_07616fd w_773509f,7c1351e3.jpg
w_17ee910 w_a31fed5 w_c6be61e new_whale w_dbb315c,7c189c00.jpg
w_2e872af new_whale w_ecb9a79 w_143b201 w_da0372d,7c19e299.jpg
new_whale w_21e178f w_7586198 w_c0bb183 w_8f50a1f,7c1baa2b.jpg
w_b729b1f w_1a5beb9 new_whale w_e59a1f0 w_813c5be,7c1cc2fa.jpg
w_8376b7e new_whale w_88f57d0 new_whale w_a846944,7c22d7ef.jpg
w_afef556 w_8ea1699 w_21e178f w_60c5ba0 w_67de30b,7c291f9a.jpg
new_whale w_b678944 w_53e9072 w_8575984 w_e57b3ce,7c2d067d.jpg
new_whale w_da63cba w_ed67618 w_cce912e w_cce912e,7c2e8ecd.jpg
w_44f0fa2 new_whale w_715d152 w_adc6e1b w_16e3c6b,7c2fd440.jpg
w_7a53e0c w_7a53e0c w_4a074b8 w_a3c6ed0 w_91b7c58,7c350ca4.jpg
new_whale w_9ea2cc3 w_d4c25b6 w_ae07541 w_daf1085,7c3d870f.jpg
new_whale w_ff7630a w_d234e6b w_4e68ddc w_4e52a49,7c416765.jpg
new_whale w_7427ace w_e0f1df1 w_999275d w_07616fd,7c495980.jpg
new_whale w_0ea2545 w_17e592c w_578a509 w_ccb4adc,7c4a1f35.jpg
new_whale w_900f9eb w_900f9eb w_6438b7d w_5abb7d5,7c524dff.jpg
w_6a78025 w_d7d60f9 w_19eb1b8 new_whale w_dfcf7fe,7c534354.jpg
w_a048f26 w_964c1b3 new_whale w_41c0098 w_9e559ff,7c559b68.jpg
w_d19a884 w_bf38f05 w_69e7dab new_whale w_541b160,7c560d47.jpg
w_cd04e1c new_whale w_7e4d894 w_0899118 w_82ed7a7,7c5c1cd1.jpg
new_whale w_f843a8d w_fa32440 w_8e451d9 w_b5e3076,7c6d41be.jpg
w_3694c7d new_whale w_715d152 w_715d152 w_c34afd7,7c700d96.jpg
w_da2efe0 new_whale w_da63cba w_351a1e1 w_351a1e1,7c72d707.jpg
w_ba1befb w_6ae7a93 w_04c1951 w_33032d1 w_53ef628,7c756a82.jpg
new_whale w_a26a029 w_549fbeb w_f19faeb w_40323ac,7c77d553.jpg
new_whale w_7257028 w_7257028 w_15d1235 w_7294a6a,7c79efc7.jpg
new_whale w_bf38f05 w_97f5054 w_1287fbc w_1287fbc,7c899479.jpg
new_whale w_0308405 w_540fd73 w_72e70e5 w_c30959a,7c8d0751.jpg
new_whale w_da0b8b5 w_cf24f84 w_607a734 w_423e872,7c90326e.jpg
w_d19a884 w_0c6dbbe w_0c6dbbe new_whale w_d19a884,7c9477a0.jpg
new_whale w_ee17a08 w_7c7a78c w_fe49bc4 w_5cef366,7c94e4fa.jpg
new_whale w_339c8ae w_aa64cc1 w_9434f0c w_0f73c3c,7c992ed3.jpg
new_whale w_4e52a49 w_4e52a49 w_7554f44 w_7b5d0f0,7c9aaafa.jpg
w_984a3fa w_2c51d33 w_f2b0e93 new_whale w_32602d9,7c9accad.jpg
w_eb9ab29 new_whale w_ca3bb23 w_ca56bf3 w_349fcbc,7c9deede.jpg
new_whale w_e7a2780 w_4a074b8 w_f546b0a w_9412d1b,7ca0596a.jpg
new_whale w_cef690d w_d88328d w_92f705d w_b4732ef,7ca52a6d.jpg
new_whale w_693c9ee w_d428980 w_cd88a48 w_a3868fb,7ca5f337.jpg
new_whale w_5f82501 w_5f82501 w_eb39613 w_5919cf7,7caebeb4.jpg
w_18df014 w_18df014 w_d62128e new_whale w_9621342,7caf445e.jpg
new_whale w_44beff0 w_d97d54c w_7b4a658 w_8fb79a2,7cb07d35.jpg
w_449503f w_43e45b6 new_whale w_5e78545 new_whale,7cb3096b.jpg
w_b9e00eb new_whale w_80c5f01 w_886257d w_0ea659e,7cbc0853.jpg
w_ba17206 new_whale w_4df0b12 w_5fc5ea5 w_8e92130,7cbd7fc7.jpg
new_whale w_cc54cee w_fe96bef w_f7a0fd7 w_7885601,7cbe5eb4.jpg
w_3e5069e w_076c122 w_ca40961 w_d4251cb w_974c0ea,7cc01ea9.jpg
new_whale w_38954da w_4fdaa2a w_d88328d w_80245ee,7cc93995.jpg
new_whale w_1af5d59 w_53ed912 w_14c8f15 w_8c408dc,7ccd671f.jpg
w_aa16da4 w_966e86e w_b0a5c8d w_9967edd w_8158b1f,7cd03ca7.jpg
w_7c7a78c new_whale w_7e841fa w_e74980b w_b890652,7cd1936f.jpg
new_whale w_99c07e8 w_ecb9a79 w_f4d89bb w_aff0877,7cd606d1.jpg
new_whale w_19a5685 w_19a5685 w_b7a832a w_217e78a,7cd6e393.jpg
w_c34afd7 w_2d25d1f w_69f4311 new_whale w_414f402,7cd8e528.jpg
new_whale w_6ab7b53 w_0bc712b w_6734e40 w_6734e40,7cdb68b6.jpg
w_abe383e w_41ed8e8 new_whale w_9122179 w_6af9dd7,7cddf60a.jpg
w_064ab78 w_987a36f w_987a36f new_whale w_976a54b,7ce06c11.jpg
w_3fc3d07 w_e3c0ae5 w_8c605d2 w_09c1e0b w_36a4e8b,7ce2490f.jpg
new_whale w_2071a4c w_ace8c54 w_fa32440 w_ba39446,7ce380f3.jpg
new_whale w_3c8eab1 w_fd1cb9d w_be32bec w_94b4478,7ce40239.jpg
w_a358522 w_98b57a1 w_1606afc w_47c5b29 new_whale,7ceb483b.jpg
w_e6b3dd4 new_whale w_c0d494d w_44237e0 new_whale,7cec1556.jpg
w_aa67f17 w_c0f377b w_15928c6 w_7e93962 w_bd65ef8,7cee2b9d.jpg
w_733fe81 new_whale w_fe87f0a w_8867074 w_f9a09c6,7cf31d75.jpg
new_whale w_127f4c6 w_ca40961 w_656490c w_718ce15,7cf5219b.jpg
new_whale w_23d3818 w_452400e w_a14a253 w_2f54c3c,7cf54fed.jpg
w_5b5a85d w_d642d4e w_98baff9 w_3f91e04 w_4c2d259,7cf83313.jpg
w_7049d9f w_61e1076 w_55132a6 w_ceffa10 new_whale,7cfe8edd.jpg
w_8ba2066 new_whale w_a59905f w_24212f5 w_24212f5,7d0ad94b.jpg
new_whale w_660195e w_b6886e5 w_703e39b w_703e39b,7d0adcbb.jpg
w_b05c57f w_53f79bc new_whale w_b478c13 new_whale,7d10fcb4.jpg
new_whale w_b729b1f w_057c418 w_057c418 w_3fdab94,7d142663.jpg
new_whale w_9122e43 w_34801a4 w_4408e45 w_6719a5b,7d16ef69.jpg
new_whale w_1957ab8 w_49c9417 w_b066aa6 w_ab4cae2,7d1744e1.jpg
w_8a1ab00 new_whale w_e4616da w_e4616da new_whale,7d175db0.jpg
new_whale w_19aeb9c w_1f10750 w_0f20cbc w_d148982,7d1d4037.jpg
new_whale w_71764b4 w_1310342 w_f18af3b w_2fe43c7,7d20d32a.jpg
new_whale w_0475042 w_703e39b w_861cc1c w_45461e6,7d276923.jpg
new_whale w_6e8486d w_c133ea8 w_6c803bf w_656afeb,7d279529.jpg
new_whale w_2fd21ec w_80211fd w_dc89c4c w_6dc88a6,7d2ba2da.jpg
new_whale w_654a5bb w_654a5bb w_90f5d3b w_90f5d3b,7d3056d2.jpg
new_whale w_c9e1cdc w_c9e1cdc w_9771603 w_1a5e7a2,7d324905.jpg
w_bc18612 w_6fcceaf w_24212f5 w_24212f5 w_e62a48d,7d332169.jpg
w_1ae1386 w_2f6a962 w_2f6a962 new_whale w_92c7ace,7d37e100.jpg
w_2250fa9 new_whale w_5af7a9c w_93dcf76 w_397e3db,7d3c079e.jpg
new_whale w_ca0ec7c w_972f231 w_2bb8c37 w_11c2836,7d47bd0f.jpg
new_whale w_c0f377b w_8db45b7 w_15928c6 w_f4e84c1,7d4b12fa.jpg
w_fc7cc24 w_c63fdb6 w_8464638 w_c01beb7 new_whale,7d5e2202.jpg
w_b41e229 new_whale w_147b62b w_9ca943b w_0526c04,7d5ed04a.jpg
new_whale w_6b4af70 w_a524549 w_9aeb18f w_b0e05b1,7d6036c0.jpg
new_whale w_43be268 w_1310342 w_8e97748 w_c027e4e,7d65cd54.jpg
new_whale w_058547a w_5d86dc6 w_46a4137 w_18bd7b3,7d791d28.jpg
w_accd48e new_whale w_e685c80 w_9d5f5cc w_4a7080a,7d7efdbb.jpg
w_f178867 new_whale w_f53deac new_whale new_whale,7d807459.jpg
new_whale w_1161030 w_76106aa w_269b090 w_fe5e78b,7d852988.jpg
w_4e52a49 w_1539fee w_4659acf w_01b2250 w_54c00ad,7d9394b3.jpg
w_be3c0f5 w_bd43538 w_bd43538 w_e21043a w_86113c4,7d9d12c1.jpg
new_whale w_b0e05b1 w_118d911 w_8b1ca89 w_8b1ca89,7da3e1ae.jpg
new_whale w_b6c4efa w_1dff010 w_aae82f8 w_f86488a,7da3f835.jpg
new_whale w_cae7677 w_5e57e8b w_392bee3 w_e6ec8ee,7da86041.jpg
new_whale w_9a94e29 w_4f37147 w_a14ccaa w_a14ccaa,7da8c193.jpg
w_1a229eb new_whale w_d053be5 w_3f5e7fc w_db0ad01,7dad2968.jpg
w_42dd100 new_whale w_ace8c54 w_ace8c54 w_b59c523,7db594d6.jpg
w_4d358e5 w_c6372b8 w_17411dd new_whale w_f014da3,7db5f7c4.jpg
w_8459e39 w_8459e39 w_4b8d0c9 w_6a4e5f2 w_104cc93,7dc1f3bb.jpg
new_whale w_fe2742d w_9ba1eee w_6d05f7f w_32a920b,7dc7aedc.jpg
w_c133ea8 new_whale w_6c803bf w_43b50e5 w_44cccf6,7dca2c1a.jpg
new_whale new_whale w_6163581 w_f95ef7c w_c45bfc3,7dcc9789.jpg
w_837646b new_whale w_b688397 w_b688397 w_1272a31,7dcf340a.jpg
new_whale w_8c1e2e4 w_8c1e2e4 w_861cc1c w_17ee910,7dd061a3.jpg
w_a913945 new_whale w_e7a238b new_whale w_8c957e0,7dd9ce5b.jpg
new_whale w_652e069 w_0e737d0 w_11f6df1 w_7b035cc,7ddaa88f.jpg
new_whale w_98baff9 new_whale w_ab4cae2 w_f4224b9,7de19f19.jpg
w_e6f5e09 w_01d6ca0 w_af9a47a w_17377c9 new_whale,7de2f5b1.jpg
new_whale w_e4f1fcc w_56f2b1e w_09f825c w_0a565c5,7de6944c.jpg
w_f2e9eb1 w_813c5be new_whale w_2cde7c0 w_2cde7c0,7de7995c.jpg
w_19f7a8b new_whale w_9d0e84a w_9a8f43f w_6c899ff,7de88806.jpg
new_whale w_29d2cec w_0ebd514 w_865c2ba w_e685c80,7deadbb0.jpg
w_5f0a14c new_whale w_5f0a14c w_3af4e73 w_ba8c7bc,7debbc2a.jpg
new_whale w_96c6151 w_f95ef7c w_5982299 w_bf31e4a,7decdf18.jpg
new_whale w_9411f86 w_a4b6a86 w_972f231 w_9e559ff,7ded76ac.jpg
w_3461d6d w_f21f2ec w_daeb296 w_daeb296 w_87e00c8,7dede0a1.jpg
new_whale w_224000c w_f3b63ba w_d97d54c w_5982299,7df16f58.jpg
new_whale w_7459706 w_95aad92 w_95aad92 w_0b0b7cc,7df26242.jpg
new_whale w_0bc712b w_b9cfdfe w_7875b79 w_697c72e,7df4e80a.jpg
new_whale w_2ac6dd5 w_9890432 w_78f64d1 w_656ef35,7dfaebf8.jpg
new_whale w_118d911 w_dbda0d6 w_62ca7c8 w_b618751,7dfba9bc.jpg
new_whale w_4759be5 w_dd5df89 w_408c5a7 w_23cd105,7e0152b2.jpg
new_whale w_886257d w_886257d w_aeca19c w_c01e25d,7e09d43b.jpg
new_whale w_ae07541 w_8c1e2e4 w_8c1e2e4 w_b33e728,7e111f0f.jpg
new_whale w_0a97a25 w_bc62c0e w_bc62c0e w_94e1ed4,7e186cd2.jpg
w_4c3cd83 new_whale w_d88328d w_17e8554 w_b4732ef,7e1e226a.jpg
w_1e9d5c7 w_9b401eb new_whale w_0819271 w_b678944,7e1e76bf.jpg
w_ba39446 new_whale w_6b03eb4 w_cf3a12e w_1904e8c,7e1f2820.jpg
new_whale w_5b2bb99 w_0ebd514 w_17ee910 w_c87c10b,7e25ee11.jpg
w_ae07541 w_2a939eb w_49bbc79 w_6c803bf new_whale,7e2967bb.jpg
new_whale w_d3ed80e w_1d4f970 w_1d4f970 w_d3ed80e,7e2fe6f6.jpg
new_whale w_11c2836 w_98baff9 w_c068ed3 w_3d1c2ef,7e331d06.jpg
new_whale w_2f6a962 w_2f6a962 w_89973e5 w_a8458c8,7e3a8fc4.jpg
w_826dc6d w_578a509 w_7f3a122 new_whale w_cdc0a1c,7e3c3189.jpg
new_whale w_0e0e856 w_e6f5e09 w_b9e00eb w_d345e80,7e3e90f3.jpg
new_whale w_9023f3b w_656afeb w_1a5e7a2 w_87e00c8,7e4ccba8.jpg
w_e282300 w_9065f2e w_0ead9d7 w_d68d206 new_whale,7e4eca37.jpg
new_whale w_e09e886 w_771374c w_771374c w_b1d054c,7e57e457.jpg
new_whale w_76106aa w_b6a95e0 w_79413a6 w_dbda0d6,7e5a2a3d.jpg
w_eff7e35 new_whale w_5982299 w_528e753 w_7faebe3,7e5a3de2.jpg
new_whale w_67f61c7 w_d40f276 w_aa7a302 w_aa7a302,7e5d1284.jpg
new_whale w_7f81ba5 w_3c3c632 w_f6086ac w_4df0b12,7e7091e9.jpg
new_whale w_15d1235 w_7294a6a w_c6439b8 w_e375961,7e74530e.jpg
new_whale w_2fd21ec w_e2bf793 w_49a3a96 w_a335e80,7e762a6f.jpg
w_4fd48e7 new_whale w_ee17a08 w_e6d0696 w_ee17a08,7e7a8639.jpg
new_whale w_b14007c w_d8e752e w_339c8ae w_b624ed1,7e816210.jpg
w_17ee910 w_1287fbc w_09d7946 w_1287fbc new_whale,7e82a699.jpg
new_whale w_2dea395 w_ec67c71 w_4b950da w_754c69f,7e87ece8.jpg
new_whale w_296749b w_1eafe46 w_987a36f w_71c7322,7e8d1ec9.jpg
w_6fcceaf new_whale w_414a0d7 w_462a117 w_fc433f7,7e8fed53.jpg
w_2a32d3d new_whale w_a26a029 w_549fbeb w_238a4ad,7e95b9b9.jpg
w_1894a1c new_whale w_032d44d w_7de72c5 w_eb7c39f,7e9d4e6f.jpg
new_whale w_4378542 w_17e8554 w_fd07344 w_d88328d,7ea03396.jpg
new_whale w_f7bf28d w_014a645 w_afe57c6 w_9874f0d,7ea452c7.jpg
w_04c1951 w_881f3c4 new_whale w_3d8c865 w_83e0203,7ea4c74f.jpg
w_a58f64d w_293b5e4 w_2ac8b4d new_whale w_b329c00,7eaa2a99.jpg
w_0e25cf2 w_2bba8c8 w_78f2e92 new_whale w_598b8ab,7eaccd6b.jpg
new_whale w_b1a4f29 w_fd1cb9d w_8209e5c w_7c9fd46,7ec2c595.jpg
new_whale w_76d2cce w_d635930 w_518129a w_5f50b5e,7ec5794c.jpg
w_17370ba w_9122179 w_6b3402d w_e0f1df1 w_cd02407,7ec7f33e.jpg
new_whale w_8464638 w_38efc2d w_f5b8faf w_cce912e,7ed1a9ab.jpg
w_2486665 w_8b56cb1 w_a3cd405 w_4855bd3 w_c92b4f5,7edf9484.jpg
w_ead305f w_652e069 new_whale w_c829019 w_f5b8faf,7ee2c880.jpg
w_552a16e new_whale w_4c8244d w_7c943ab w_65c80dd,7ee3de52.jpg
new_whale w_f8024be w_9b804bd w_7311fe4 w_7311fe4,7ee58f6d.jpg
w_338b130 w_5014d6c w_a8f9a1e new_whale w_549fbeb,7eebad92.jpg
new_whale w_c39fceb w_f7d5919 w_a67a1bc w_09be3ad,7eede9d8.jpg
new_whale w_661dacb w_2d99a0c w_b47a4a1 w_29c9595,7eef235f.jpg
new_whale w_e4d3ec3 new_whale w_7ad249d w_8f1aa27,7eefb619.jpg
new_whale w_43b50e5 w_c133ea8 w_4439f3d w_85f9040,7ef63a80.jpg
new_whale w_f3e948c w_fba3bde w_11ca856 w_def715a,7f03e2bb.jpg
w_532fb22 w_1911cbb w_4e1f7bd new_whale w_17a2610,7f0a57e6.jpg
w_88c4d5e new_whale w_cf8b725 w_62f804d w_0beef28,7f0a5c6c.jpg
w_4a069df new_whale w_0e81e60 w_aed8c22 w_ca5f17f,7f0b6c80.jpg
new_whale w_2b939eb w_41ec10a w_c20f21c w_899f659,7f0dca3b.jpg
new_whale w_01f211f w_01f211f w_ad512ec w_9874f0d,7f0f005c.jpg
new_whale w_1dd8e68 w_0466071 w_f369a80 w_9205d40,7f11727e.jpg
new_whale w_7875b79 w_2c83e22 w_447643b w_5b1fa1d,7f16c886.jpg
w_12cdfbd w_3b0894d w_e62b5d8 w_f208155 w_4457d27,7f180ff4.jpg
new_whale w_f208155 w_1b1c4f1 w_62f804d w_8bc853a,7f18e3ae.jpg
w_3f90907 w_8201aa8 new_whale w_1dff010 w_3026ce2,7f1b9071.jpg
new_whale w_3feb2df w_1d0e29a w_102ab59 w_4b950da,7f209f64.jpg
new_whale w_ec67c71 w_fab0b50 w_00fbb4e w_a74742c,7f214eac.jpg
w_06ff732 new_whale w_2c1634b w_6e5b022 w_7637760,7f22dd69.jpg
new_whale w_e126028 w_15427c3 w_8e4abc9 w_b688397,7f297c92.jpg
new_whale w_59eb8ae w_987a36f w_6f2c662 w_c263d43,7f316683.jpg
w_2071a4c w_847088b w_735ce7d w_7e8b270 w_a2a1378,7f34a490.jpg
new_whale w_a8335f2 w_fea7fe6 w_c622a3f w_c622a3f,7f35e607.jpg
w_fd1cb9d new_whale w_559ce61 w_3c304db w_4e52a49,7f3b271e.jpg
w_c0f3e88 w_36ac97f new_whale w_ad370e1 w_3c9f80b,7f3e5221.jpg
new_whale w_3d0bc7a w_711aaa1 w_ccca0db w_4855bd3,7f3ed146.jpg
new_whale w_bd61ca9 new_whale w_bf4880a w_91572bb,7f40d547.jpg
new_whale w_da6d50b w_637f363 w_c9ba30c w_93bf889,7f46db19.jpg
w_4ec48a9 w_4ec48a9 new_whale w_f031837 w_ca27f31,7f46ea39.jpg
new_whale w_96fd936 w_59349ea w_4848a3c w_43340c5,7f48832c.jpg
new_whale w_4f103de w_9434f0c w_0793503 w_ba1befb,7f4b57d4.jpg
new_whale w_52e7cf6 w_8158b1f w_fce6ab2 w_e17c752,7f4c8967.jpg
new_whale w_a9f41fd w_4bd8388 w_059ac60 w_95af6a2,7f50dd5b.jpg
new_whale w_8c1e2e4 w_8c1e2e4 w_8d08f9e w_8d83172,7f51b446.jpg
w_20c671c w_e10dff3 w_20c671c new_whale w_4e2652d,7f52e7fa.jpg
new_whale w_c8af414 w_d7d60f9 w_6a78025 w_4378542,7f53b158.jpg
new_whale w_471ae98 w_eb0a6ed w_b04d4f1 w_2725793,7f573663.jpg
new_whale w_7554f44 w_7554f44 w_120927e w_569c2c7,7f5be726.jpg
new_whale w_9a0c14d w_96c6151 w_1ec0481 w_d97d54c,7f5e5a28.jpg
new_whale w_8c1dab2 w_49bbc79 w_49bbc79 w_e8778ce,7f5ece24.jpg
new_whale w_8d4654f w_1d2fbc1 w_f19faeb w_09dd18c,7f696d7e.jpg
w_6556c5c w_f104523 w_0f89e72 new_whale w_71bfc77,7f6cb3d6.jpg
w_4b1fad6 new_whale w_e94a3b2 w_989fbbb w_8f1aa27,7f71d3e5.jpg
new_whale w_ebc5837 w_dbda0d6 w_f02bf23 w_bbd9409,7f720ce1.jpg
new_whale w_f19faeb w_f19faeb w_73d5489 w_7f1f728,7f744053.jpg
w_0e9f6d9 w_1a70685 new_whale w_bcad8eb w_5abb7d5,7f74b2f8.jpg
new_whale w_68a3df0 w_d708c5a w_a533837 w_9948a99,7f74fbfd.jpg
new_whale w_eec1133 w_4855bd3 w_7a9f3f6 w_44f0fa2,7f7619df.jpg
new_whale w_12cdfbd w_79185c2 w_8b56cb1 w_a789d49,7f78a5b1.jpg
w_754c69f w_2dea395 w_7b0fb1d w_fe8233d w_49308df,7f7a3014.jpg
w_62f299e w_a9dd349 new_whale w_ee9c4d7 w_1eafe46,7f7afb9c.jpg
new_whale w_d9055d1 w_3cf3853 w_71c7322 w_c58b474,7f8c7c0e.jpg
new_whale w_7e5cc5e w_0e9f6d9 w_dcb1f2a w_95874a5,7f8f5a11.jpg
w_9771603 w_e54feba w_0ebd514 w_c027e4e new_whale,7f9029fa.jpg
new_whale w_9a0c14d w_f95ef7c w_721d2e9 w_d97d54c,7f90d10a.jpg
w_38efc2d w_19eb1b8 new_whale w_2a1d45c new_whale,7f91c51b.jpg
new_whale w_c9dc73e w_ea96346 w_7b1686d w_27cf4e2,7f9561d4.jpg
new_whale w_1a229eb w_73d5489 w_0d049cf w_1a229eb,7f95b119.jpg
w_f2b8caf w_2cb8996 w_d84ed05 w_dfcf7fe w_e5d6443,7f9a7b54.jpg
new_whale w_ace8c54 w_452f14f w_7f999ff w_1c69443,7f9f8626.jpg
new_whale w_95874a5 w_d5ec83f w_d5ec83f w_95874a5,7f9fc3be.jpg
new_whale w_56bbc91 w_b729b1f w_6418af0 w_987a36f,7fa1227d.jpg
new_whale w_fa32440 new_whale new_whale w_85f9040,7fa1be66.jpg
w_51df6ac new_whale w_ea9b531 w_1eafe46 w_3745f59,7fa4cc8e.jpg
w_ec853f1 new_whale new_whale w_a0fc1a7 w_15d7ecf,7fa99f8d.jpg
w_4b7b80b w_4b7b80b w_941581c w_67599af new_whale,7fb09955.jpg
new_whale w_211aa88 w_8bde95b w_de3cab3 w_b67bfeb,7fb78f81.jpg
new_whale w_91f80eb w_90201e3 w_6202983 w_f843c4d,7fbefd40.jpg
w_cbac51f w_e8778ce w_37c23fa w_17cb04d w_65e2424,7fdea404.jpg
new_whale w_02a768d w_d9d4088 w_00d8453 w_ed5a7c6,7fdffb15.jpg
new_whale w_f792125 w_77fbe5c w_4225bb3 w_d19a884,7fe3dbb2.jpg
new_whale w_91faa95 w_d3c8520 w_7e4d894 w_1da7080,7fe603c7.jpg
new_whale w_86113c4 w_e594616 w_9b401eb w_86113c4,7fe7b7df.jpg
w_fbcb6e4 new_whale w_0475042 w_1287fbc w_a400ddd,7ff01ddd.jpg
new_whale w_f4b95e7 w_f774c8b w_491607b w_987a36f,800677dd.jpg
new_whale w_fc433f7 w_0e737d0 w_6c899ff w_559ce61,8008ccb5.jpg
new_whale w_1743d93 w_338d945 w_6c8601e w_331df94,800e1416.jpg
w_9411f86 w_cda4b05 w_0d60fdd w_0d60fdd w_c9dd32e,8012a979.jpg
new_whale w_654a5bb w_8de6989 w_8de6989 w_62aed54,8015cc46.jpg
new_whale w_b1a4f29 w_42c631a w_01d6ca0 w_3d2724b,80170906.jpg
new_whale w_d10c9ff w_78a6f56 w_4643de5 w_64f3545,802455cc.jpg
w_3b016f0 w_6863829 new_whale w_79774a5 w_a846944,8025072c.jpg
new_whale w_6438b7d w_0337aa5 w_43be268 w_7c7a78c,802bdcd2.jpg
new_whale w_272259b w_43be268 w_a59905f w_e62a48d,802f22ee.jpg
new_whale w_e0799da w_ed10a36 w_b678944 w_037955e,8030b09b.jpg
w_690fc6b w_ce7c6c0 new_whale w_aaafb64 w_ed32859,80411f61.jpg
w_60c5e7e w_2730966 new_whale w_f8cd6b6 w_4f248f3,8045d8a8.jpg
new_whale w_0475042 w_f18df18 w_95874a5 w_33b9360,804876f5.jpg
w_d0b237f w_b3cc032 w_d7760f0 w_bcf23a8 w_d037229,804c69aa.jpg
new_whale w_44cccf6 w_286ec5f w_82e0d98 w_c529cf1,804d7cc5.jpg
w_f792125 new_whale w_d19a884 w_4a4bb3f w_3e02970,804fdd64.jpg
new_whale w_a8ec52f w_893e77a w_0466071 new_whale,8051910a.jpg
w_d9aab0a new_whale w_d9aab0a w_d9aab0a w_35f0fd9,805662a0.jpg
new_whale w_46ec664 w_1a5e7a2 w_e249d94 w_531d2e5,806175d1.jpg
new_whale w_e375961 w_0f20cbc w_b329c00 w_c11932e,80648d9f.jpg
new_whale w_b4a5677 w_d037229 w_d037229 w_d88328d,8066c6d0.jpg
w_41fa033 w_94c6edb new_whale new_whale w_42c631a,8066e25a.jpg
w_9d83b4d w_f792125 w_b7fe199 w_86cc90f new_whale,806a584d.jpg
new_whale w_899f659 w_ba0366f w_2863d51 w_0a97a25,806ede72.jpg
new_whale w_5cc2285 w_2a04ceb w_2a04ceb w_d249ed6,80715b80.jpg
new_whale w_ab4cae2 w_ee24bac w_4b7b80b w_ab4cae2,807293e7.jpg
